"","rank","title","release_year","rating","runtime","genres","movie_rating","metascore","description","directors","actors","votes","gross_in_millions"
"79",79,"deliver us from evil",2014,"r",118,"horror, mystery, thriller",6.2,"40","new york police officer ralph sarchie investigates a series of crimes. he joins forces with an unconventional priest, schooled in the rites of exorcism, to combat the possessions that are terrorizing their city.","scott derrickson","eric bana, edgar ramírez, olivia munn, chris coy",59164,NA
"80",80,"noah",2014,"pg-13",138,"action, adventure, drama",5.8,"68","noah is chosen by god to undertake a momentous mission before an apocalyptic flood cleanses the world.","darren aronofsky","russell crowe, jennifer connelly, anthony hopkins, emma watson",214665,NA
"81",81,"night at the museum: secret of the tomb",2014,"pg",98,"adventure, comedy, family",6.2,"47","larry spans the globe, uniting favorite and new characters while embarking on an epic quest to save the magic before it is gone forever.","shawn levy","ben stiller, robin williams, owen wilson, dick van dyke",79001,NA
"82",82,"non-stop",2014,"pg-13",106,"action, mystery, thriller",7,"56","an air marshal springs into action during a transatlantic flight after receiving a series of text messages demanding $150 million into an off-shore account, or someone will die every 20 minutes.","jaume collet-serra","liam neeson, julianne moore, scoot mcnairy, michelle dockery",217507,NA
"83",83,"not cool",2014,"not rated",93,"comedy",4.8,"1","a group of modern day pittsburgh teenagers spend their thanksgiving break experiencing a mixture of love, friendship, partying, and sex.","shane dawson","shane dawson, cherami leigh, drew monson, lisa schwartz",4657,NA
"84",84,"winter's tale",2014,"pg-13",118,"drama, fantasy, mystery",6.2,"31","a burglar falls for an heiress as she dies in his arms. when he learns that he has the gift of reincarnation, he sets out to save her.","akiva goldsman","colin farrell, jessica brown findlay, russell crowe, jennifer connelly",45221,NA
"85",85,"tusk",2014,"r",102,"comedy, drama, horror",5.4,"55","a brash and arrogant podcaster gets more than he bargained for when he travels to canada to interview a mysterious recluse... who has a rather disturbing fondness for walruses.","kevin smith","justin long, michael parks, haley joel osment, genesis rodriguez",35818,NA
"86",86,"the monuments men",2014,"pg-13",118,"drama, history, war",6.1,"52","an unlikely world war ii platoon is tasked to rescue art masterpieces from nazi thieves and return them to their owners.","george clooney","george clooney, matt damon, bill murray, cate blanchett",110526,NA
"87",87,"neighbors",2014,"r",97,"comedy",6.3,"68","after they are forced to live next to a fraternity house, a couple with a newborn baby do whatever they can to take them down.","nicholas stoller","seth rogen, rose byrne, zac efron, lisa kudrow",244502,NA
"88",88,"before we go",2014,"pg-13",95,"comedy, drama, romance",6.8,"31","two strangers stuck in manhattan for the night grow into each other's most trusted confidants when an evening of unexpected adventure forces them to confront their fears and take control of their lives.","chris evans","chris evans, alice eve, emma fitzpatrick, john cullum",34867,NA
"89",89,"backcountry",2014,"r",92,"drama, horror, thriller",6,"62","an urban couple go camping in the woods and find themselves lost in the territory of a predatory black bear.","adam macdonald","jeff roop, missy peregrym, nicholas campbell, eric balfour",12916,NA
"90",90,"if i stay",2014,"pg-13",107,"drama, fantasy, music",6.8,"46","life changes in an instant for young mia hall after a car accident puts her in a coma. during an out-of-body experience, she must decide whether to wake up and live a life far different than she had imagined. the choice is hers if she can go on.","r.j. cutler","chloë grace moretz, mireille enos, jamie blackley, joshua leonard",96358,NA
"91",91,"endless love",2014,"pg-13",104,"drama, romance",6.3,"30","the story of a privileged girl and a charismatic boy whose instant desire sparks a love affair made only more reckless by parents trying to keep them apart.","shana feste","gabriella wilde, alex pettyfer, bruce greenwood, robert patrick",34862,NA
"92",92,"goodnight mommy",2014,"r",99,"horror, mystery, thriller",6.7,"81","twin boys move to a new home with their mother after she has face changing cosmetic surgery, but under her bandages is someone the children don't recognize.","severin fiala, veronika franz","lukas schwarz, elias schwarz, susanne wuest, hans escher",29837,NA
"93",93,"the interview",2014,"r",112,"comedy",6.6,"52","dave skylark and his producer aaron rapoport run the celebrity tabloid show ""skylark tonight"". when they land an interview with a surprise fan, north korean dictator kim jong-un, they are recruited by the cia to turn their trip to pyongyang into an assassination mission.","evan goldberg, seth rogen","james franco, seth rogen, randall park, lizzy caplan",268234,NA
"94",94,"unfriended",2014,"r",83,"drama, horror, mystery",5.6,"59","a group of online chat room friends find themselves haunted by a mysterious, supernatural force using the account of their dead friend.","levan gabriadze","heather sossaman, matthew bohrer, courtney halverson, shelley hennig",53657,NA
"95",95,"leprechaun: origins",2014,"r",90,"fantasy, horror",3.3,NA,"two young couples backpacking through ireland discover that one of ireland's most famous legends is a terrifying reality.","zach lipovsky","dylan postl, stephanie bennett, andrew dunbar, melissa roxburgh",3709,NA
"96",96,"how to train your dragon 2",2014,"pg",102,"animation, action, adventure",7.8,"76","when hiccup and toothless discover an ice cave that is home to hundreds of new wild dragons and the mysterious dragon rider, the two friends find themselves at the center of a battle to protect the peace.","dean deblois","jay baruchel, cate blanchett, gerard butler, craig ferguson",245065,NA
"97",97,"draft day",2014,"pg-13",110,"drama, sport",6.8,"54","at the nfl draft, general manager sonny weaver has the opportunity to rebuild his team when he trades for the number one pick. he must decide what he's willing to sacrifice on a life-changing day for a few hundred young men with nfl dreams.","ivan reitman","kevin costner, chadwick boseman, jennifer garner, frank langella",43841,NA
"98",98,"wrong turn 6: last resort",2014,"r",91,"horror",4.3,NA,"an inheritance leads a young man and his friends to an abandoned resort inhabited by two sketchy caretakers and a clan of mutant cannibals.","valeri milev","anthony ilott, chris jarvis, aqueela zoll, sadie katz",9677,NA
"99",99,"taken 3",2014,"pg-13",109,"action, thriller",6,"26","ex-government operative bryan mills is accused of a ruthless murder he never committed or witnessed. as he is tracked and pursued, mills brings out his particular set of skills to find the true killer and clear his name.","olivier megaton","liam neeson, forest whitaker, maggie grace, famke janssen",150095,NA
"100",100,"the guest",2014,"r",100,"mystery, thriller",6.7,"76","a soldier introduces himself to the peterson family, claiming to be a friend of their son who died in action. after the young man is welcomed into their home, a series of accidental deaths seem to be connected to his presence.","adam wingard","dan stevens, sheila kelley, maika monroe, joel david moore",74381,NA
