"","rank","title","release_year","rating","runtime","genres","movie_rating","metascore","description","directors","actors","votes","gross_in_millions"
"88",88,"a woman of the world",1925,NA,70,"comedy, drama",7.2,NA,"a sensual european countess arrives at a small american town where she quickly provokes moral outrage from the community. upon arriving, even before she steps out of her taxi a district ...                see full summary »","malcolm st. clair","pola negri, charles emmett mack, holmes herbert, blanche mehaffey",85,NA
"89",89,"jewish luck",1925,NA,100,"comedy, romance",6.7,NA,"jewish luck revolves around menakhem mendl (one of sholem aleichem's characters), a daydreaming entrepreneur who specializes in doomed strike-it-rich schemes. despite jewish oppression in ...                see full summary »","alexis granowsky","solomon mikhoels, moisei goldblat, tamara adelgeym, s. epstein",71,NA
"90",90,"paths to paradise",1925,NA,78,"comedy, crime, romance",7,NA,"a con-woman has a nice business going in fleecing gullible tourists who want a genuine 'underworld' experience -- but the tables are turned when one of her victims turns out to be less ...                see full summary »","clarence g. badger","betty compson, raymond griffith, tom santschi, bert woodruff",103,NA
"91",91,"the thundering herd",1925,NA,70,"western",5.5,NA,"add a plot","william k. howard","jack holt, lois wilson, noah beery, raymond hatton",12,NA
"92",92,"my lady of whims",1925,"not rated",59,NA,NA,NA,"clara plays wealthy prudence severin, whose reckless, profligate behavior causes nothing but headaches for her father. a detective (lee moran) is hired to protect prudence from herself, but to no avail.","dallas m. fitzgerald","clara bow, donald keith, carmelita geraghty, francis mcdonald",64,NA
"93",93,"the lady",1925,NA,96,"drama",7.6,NA,"a young woman marries the wastrel son of a british aristocrat. her husband, who has been disinherited by his father, loses what little money he has left gambling in casinos and then dies, ...                see full summary »","frank borzage","norma talmadge, wallace macdonald, brandon hurst, alfred j. goulding",115,NA
"94",94,"the home maker",1925,NA,80,"drama",6,NA,"a man's life seems to be falling apart. he's bored with his job, gets passed over for a promotion and, when the pressures get to be too much, he tries to commit suicide, but he even fails ...                see full summary »","king baggot","alice joyce, clive brook, billy kent schaefer, maurice murphy",6,NA
"95",95,"daughters who pay",1925,NA,NA,NA,NA,NA,"immediately after the october revolution, in russia, stir unrest and propaganda against the government of the united states. bela lugosi is serge oumansky, communist agent trying to ...                see full summary »","george terwilliger","marguerite de la motte, john bowers, j. barney sherry, joseph striker",7,NA
"96",96,"men and women",1925,NA,60,NA,NA,NA,"add a plot","william c. de mille",NA,NA,NA
"97",97,"bajirao mastani",1925,NA,NA,NA,NA,NA,"an historical film, focusing on the maratha peshwai (18th c.).","nanubhai b. desai, bhalji pendharkar","master vithal, nanasaheb phatak, miss jones, sayani atish",18,NA
"98",98,"die puppe vom lunapark",1925,NA,NA,NA,NA,NA,"add a plot","jaap speyer",NA,NA,NA
"99",99,"adventure",1925,NA,70,"adventure, drama",5.6,NA,"david sheldon owns a plantation in the solomon islands. many of his field hands die of blackwater fever, and then he becomes sick himself. joan lackland, a female soldier of fortune, ...                see full summary »","victor fleming                  :tom moore, pauline","tom moore, pauline starke, wallace beery, raymond hatton",11,NA
"100",100,"the red kimona",1925,"unrated",77,"drama, romance",6.4,NA,"a small town girl finds escape from her cruel home life in the arms of a handsome stranger. soon she finds herself working as a prostitute in new orleans, desperately clinging to the belief that he really loves her.","walter lang, dorothy davenport","priscilla bonner, nellie bly baker, carl miller, mary carr",196,NA
