"","rank","title","release_year","rating","runtime","genres","movie_rating","metascore","description","directors","actors","votes","gross_in_millions"
"88",88,"pola x",1999,"not rated",134,"drama, romance",5.8,"65","a young writer becomes intrigued with a mysterious dark-haired woman who claims to be his long-lost sister and he begin an unusual relationship with her prompting a downward spiral involving his domineering mother and lovely fiancée","leos carax","guillaume depardieu, yekaterina golubeva, catherine deneuve, delphine chuillot",3781,NA
"89",89,"the general's daughter",1999,"r",116,"crime, drama, mystery",6.3,"47","when the daughter of a well-known and well-respected base commander is murdered, an undercover detective is summoned to look into the matter and finds a slew of cover-ups at west point.","simon west","john travolta, madeleine stowe, james cromwell, timothy hutton",45653,NA
"90",90,"for love of the game",1999,"pg-13",137,"drama, romance, sport",6.6,"43","a washed up pitcher flashes through his career.","sam raimi","kevin costner, kelly preston, john c. reilly, jena malone",27604,NA
"91",91,"inspector gadget",1999,"pg",78,"action, adventure, comedy",4.1,"36","a security guard's dreams come true when he is selected to be transformed into a cybernetic police officer.","david kellogg","matthew broderick, rupert everett, joely fisher, michelle trachtenberg",39091,NA
"92",92,"teaching mrs. tingle",1999,"pg-13",96,"comedy, thriller",5.2,"35","the story of a girl who is willing to do anything to become valedictorian, even if it means murdering the teacher that stands in her way.","kevin williamson","helen mirren, marisa coughlan, katie holmes, jeffrey tambor",18003,NA
"93",93,"forces of nature",1999,"pg-13",105,"comedy, romance",5.4,"46","a soon-to-be-married man encounters an exciting stranger after his plane suffers an accident on takeoff.","bronwen hughes","sandra bullock, ben affleck, maura tierney, steve zahn",28348,NA
"94",94,"virus",1999,"r",99,"action, horror, thriller",4.9,"19","when the crew of an american tugboat boards an abandoned russian research vessel, the alien life form aboard regards them as a virus which must be destroyed.","john bruno","jamie lee curtis, william baldwin, donald sutherland, joanna pacula",23269,NA
"95",95,"message in a bottle",1999,"pg-13",126,"drama, romance",6.2,"39","a woman discovers a tragic love letter in a bottle on a beach, and is determined to track down its author.","luis mandoki","kevin costner, robin wright, paul newman, john savage",31195,NA
"96",96,"summer of sam",1999,"r",142,"crime, drama, romance",6.6,"67","spike lee's take on the ""son of sam"" murders in new york city during the summer of 1977 centering on the residents of an italian-american northeast bronx neighborhood who live in fear and distrust of one another.","spike lee","john leguizamo, adrien brody, mira sorvino, jennifer esposito",32535,NA
"97",97,"but i'm a cheerleader",1999,"r",85,"comedy, drama, romance",6.6,"39","a naive teenager is sent to rehab camp when her straitlaced parents and friends suspect her of being a lesbian.","jamie babbit","natasha lyonne, clea duvall, michelle williams, brandt wille",21410,NA
"98",98,"better than chocolate",1999,"r",101,"comedy, drama, romance",6.2,NA,"two attractive young lesbians, maggie and kim, meet in vancouver, develop a passionate romance, and move in together. meanwhile, maggie's well-meaning but naive mother lila gets divorced ...                see full summary »","anne wheeler","wendy crewson, karyn dwyer, christina cox, ann-marie macdonald",6990,NA
"99",99,"arlington road",1999,"r",117,"crime, drama, thriller",7.2,"65","a man begins to suspect his neighbors are not what they appear to be and their secrets could be deadly.","mark pellington","jeff bridges, tim robbins, joan cusack, hope davis",73384,NA
"100",100,"bringing out the dead",1999,"r",121,"drama, thriller",6.8,"70","haunted by the patients he failed to save, an extremely burned-out manhattan ambulance paramedic fights to maintain his sanity over three fraught and turbulent nights.","martin scorsese","nicolas cage, patricia arquette, john goodman, ving rhames",55983,NA
