"","rank","title","release_year","rating","runtime","genres","movie_rating","metascore","description","directors","actors","votes","gross_in_millions"
"82",82,"loving vincent",2017,"pg-13",94,"animation, biography, crime",8,"62","in a story depicted in oil painted animation, a young man comes to the last hometown of painter vincent van gogh to deliver the troubled artist's final letter and ends up investigating his final days there.","dorota kobiela, hugh welchman","douglas booth, jerome flynn, robert gulaczyk, helen mccrory",3617,NA
"83",83,"jumanji: welcome to the jungle",2017,NA,NA,NA,NA,NA,NA,"jake kasdan",NA,NA,NA
"84",84,"ayla: the daughter of war",2017,NA,125,"drama, history, war",9.3,NA,"in 1950, amidst the ravages of the korean war, sergeant süleyman stumbles upon a a half-frozen little girl, with no parents and no help in sight. frantic, scared and on the verge of death, ...                see full summary »","can ulkay","çetin tekindor, ismail hacioglu, kyung-jin lee, kim seol",7514,NA
"85",85,"king arthur: legend of the sword",2017,"pg-13",126,"action, adventure, drama",6.9,NA,"robbed of his birthright, arthur comes up the hard way in the back alleys of the city. but once he pulls the sword from the stone, he is forced to acknowledge his true legacy - whether he likes it or not.","guy ritchie","charlie hunnam, astrid bergès-frisbey, jude law, djimon hounsou",120389,NA
"86",86,"the hitman's bodyguard",2017,"r",118,"action, comedy",7,"47","the world's top bodyguard gets a new client, a hit man who must testify at the international court of justice. they must put their differences aside and work together to make it to the trial on time.","patrick hughes","ryan reynolds, samuel l. jackson, gary oldman, elodie yung",75471,NA
"87",87,"what happened to monday",2017,"tv-ma",123,"action, adventure, crime",6.9,"47","in a world where families are limited to one child due to overpopulation, a set of identical septuplets must avoid being put to a long sleep by the government and dangerous infighting while investigating the disappearance of one of their own.","tommy wirkola","noomi rapace, glenn close, willem dafoe, marwan kenzari",31113,NA
"88",88,"brad's status",2017,"r",102,"comedy, drama, music",6.7,"72","a father takes his son to tour colleges on the east coast and meets up with an old friend who makes him feel inferior about his life's choices.","mike white","ben stiller, austin abrams, jenna fischer, michael sheen",1642,NA
"89",89,"girls trip",2017,"r",122,"comedy",6.4,"71","when four lifelong friends travel to new orleans for the annual essence festival, sisterhoods are rekindled, wild sides are rediscovered, and there's enough dancing, drinking, brawling, and romancing to make the big easy blush.","malcolm d. lee","regina hall, queen latifah, jada pinkett smith, tiffany haddish",11846,NA
"90",90,"the beguiled",2017,"r",93,"drama, war",6.5,"77","the unexpected arrival of a wounded union soldier at a girls school in virginia during the american civil war leads to jealousy and betrayal.","sofia coppola","nicole kidman, kirsten dunst, elle fanning, colin farrell",20862,NA
"91",91,"fifty shades darker",2017,"r",118,"drama, romance",4.6,"33","while christian wrestles with his inner demons, anastasia must confront the anger and envy of the women who came before her.","james foley","dakota johnson, jamie dornan, eric johnson, eloise mumford",58553,NA
"92",92,"the square",2017,"r",142,"comedy, drama",7.8,"72","the square is a poignant satirical drama reflecting our times - about the sense of community, moral courage and the affluent person's need for egocentricity in an increasingly uncertain world.","ruben östlund","claes bang, elisabeth moss, dominic west, terry notary",5316,NA
"93",93,"the death of stalin",2017,NA,106,"biography, comedy, drama",7.7,"88","follows the soviet dictator's last days and depicts the chaos of the regime after his death.","armando iannucci","jason isaacs, andrea riseborough, olga kurylenko, steve buscemi",2921,NA
"94",94,"overdrive",2017,"pg-13",93,"action, thriller",5.3,NA,"two car thief brothers, who journey to the south of france for new opportunities, wind up in the cross hairs of the local crime boss.","antonio negret","scott eastwood, freddie thorp, ana de armas, gaia weiss",4343,NA
"95",95,"despicable me 3",2017,"pg",90,"animation, action, adventure",6.3,"49","gru meets his long-lost charming, cheerful, and more successful twin brother dru who wants to team up with him for one last criminal heist.","kyle balda, pierre coffin, eric guillon","steve carell, kristen wiig, trey parker, miranda cosgrove",52150,NA
"96",96,"the florida project",2017,"r",111,"drama",8.1,"92","set over one summer, the film follows precocious 6-year-old moonee as she courts mischief and adventure with her ragtag playmates and bonds with her rebellious but caring mother, all while living in the shadows of disney world.","sean baker","brooklynn prince, bria vinaite, willem dafoe, valeria cotto",3069,NA
"97",97,"it comes at night",2017,"r",91,"horror, mystery",6.2,"78","secure within a desolate home as an unnatural threat terrorizes the world, a man has established a tenuous domestic order with his wife and son. then a desperate young family arrives seeking refuge.","trey edward shults","joel edgerton, christopher abbott, carmen ejogo, riley keough",38122,NA
"98",98,"the lego ninjago movie",2017,"pg",101,"animation, action, adventure",6.1,"55","shunned by everyone for being the son of an evil warlord, a teenager seeks to defeat him with the help of his fellow ninjas.","charlie bean, paul fisher, bob logan","jackie chan, dave franco, fred armisen, kumail nanjiani",5945,NA
"99",99,"victoria and abdul",2017,"pg-13",111,"biography, drama, history",6.9,"57","queen victoria strikes up an unlikely friendship with a young indian clerk named abdul karim.","stephen frears","judi dench, ali fazal, tim pigott-smith, eddie izzard",4777,NA
"100",100,"life",2017,"r",104,"horror, sci-fi, thriller",6.6,"54","a team of scientists aboard the international space station discover a rapidly evolving life form that caused extinction on mars and now threatens all life on earth.","daniel espinosa","jake gyllenhaal, rebecca ferguson, ryan reynolds, hiroyuki sanada",130898,NA
