"","rank","title","release_year","rating","runtime","genres","movie_rating","metascore","description","directors","actors","votes","gross_in_millions"
"79",79,"mud",2012,"pg-13",130,"drama",7.4,"76","two young boys encounter a fugitive and form a pact to help him evade the vigilantes that are on his trail and to reunite him with his true love.","jeff nichols","matthew mcconaughey, tye sheridan, jacob lofland, sam shepard",146741,NA
"80",80,"that's my boy",2012,"r",116,"comedy",5.6,"31","while in his teens, donny fathered a son, todd, and raised him as a single parent up until todd's 18th birthday. now, after not seeing each other for years, todd's world comes crashing down when donny resurfaces just before todd's wedding.","sean anders","adam sandler, andy samberg, leighton meester, susan sarandon",76429,NA
"81",81,"the lucky one",2012,"pg-13",101,"drama, romance",6.5,"39","a marine travels to louisiana after serving three tours in iraq and searches for the unknown woman he believes was his good luck charm during the war.","scott hicks","zac efron, taylor schilling, blythe danner, riley thomas stewart",85781,NA
"82",82,"taken 2",2012,"pg-13",92,"action, crime, thriller",6.3,"45","in istanbul, retired cia operative bryan mills and his wife are taken hostage by the father of a kidnapper mills killed while rescuing his daughter.","olivier megaton","liam neeson, famke janssen, maggie grace, leland orser",256075,NA
"83",83,"red dawn",2012,"pg-13",93,"action, sci-fi, thriller",5.4,"31","a group of teenagers look to save their town from an invasion of north korean soldiers.","dan bradley","chris hemsworth, isabel lucas, josh hutcherson, josh peck",65651,NA
"84",84,"mirror mirror",2012,"pg",106,"adventure, comedy, drama",5.6,"46","an evil queen steals control of a kingdom and an exiled princess enlists the help of seven resourceful rebels to win back her birthright.","tarsem singh","lily collins, julia roberts, armie hammer, nathan lane",74999,NA
"85",85,"flying blind",2012,NA,93,"drama",5.7,NA,"a stylish mix of erotic love story and political thriller. helen mccrory stars as a brilliant aerospace engineer who is drawn into a passionate affair with a younger male student while ...                see full summary »","katarzyna klimkiewicz","helen mccrory, kenneth cranham, lorcan cranitch, razane jammal",389,NA
"86",86,"rock of ages",2012,"pg-13",123,"comedy, drama, musical",5.9,"47","a small town girl and a city boy meet on the sunset strip, while pursuing their hollywood dreams.","adam shankman","julianne hough, diego boneta, tom cruise, alec baldwin",65773,NA
"87",87,"the lords of salem",2012,"r",101,"horror, thriller",5.1,"57","heidi, a radio dj, is sent a box containing a record - a ""gift from the lords"". the sounds within the grooves trigger flashbacks of her town's violent past. is heidi going mad, or are the lords back to take revenge on salem, massachusetts?","rob zombie","sheri moon zombie, meg foster, bruce davison, jeff daniel phillips",22792,NA
"88",88,"the sapphires",2012,"pg-13",103,"biography, comedy, drama",7.1,"67","it's 1968, and four young, talented australian aboriginal girls learn about love, friendship and war when their all-girl group the sapphires entertain the us troops in vietnam.","wayne blair","chris o'dowd, deborah mailman, jessica mauboy, shari sebbens",11268,NA
"89",89,"underworld awakening",2012,"r",88,"action, fantasy, horror",6.4,"39","when human forces discover the existence of the vampire and lycan clans, a war to eradicate both species commences. the vampire warrior selene leads the battle against humankind.","måns mårlind, björn stein","kate beckinsale, michael ealy, india eisley, stephen rea",130414,NA
"90",90,"the lorax",2012,"pg",86,"animation, adventure, comedy",6.4,"46","a 12-year-old boy searches for the one thing that will enable him to win the affection of the girl of his dreams. to find it he must discover the story of the lorax, the grumpy yet charming creature who fights to protect his world.","chris renaud, kyle balda","zac efron, taylor swift, danny devito, ed helms",83619,NA
"91",91,"stuck in love",2012,"r",97,"comedy, drama, romance",7.3,"49","an acclaimed writer, his ex-wife, and their teenaged children come to terms with the complexities of love in all its forms over the course of one tumultuous year.","josh boone","greg kinnear, jennifer connelly, lily collins, nat wolff",72936,NA
"92",92,"wrath of the titans",2012,"pg-13",99,"action, adventure, fantasy",5.8,"37","perseus braves the treacherous underworld to rescue his father, zeus, captured by his son, ares, and brother hades who unleash the ancient titans upon the world.","jonathan liebesman","sam worthington, liam neeson, rosamund pike, ralph fiennes",162418,NA
"93",93,"the possession",2012,"pg-13",92,"horror, thriller",5.9,"45","a young girl buys an antique box at a yard sale, unaware that inside the collectible lives a malicious ancient spirit. the girl's father teams with his ex-wife to find a way to end the curse upon their child.","ole bornedal","natasha calis, kyra sedgwick, jeffrey dean morgan, madison davenport",50516,NA
"94",94,"lay the favorite",2012,"r",94,"comedy, drama, romance",4.8,"38","ex-private dancer beth aspires to be a las vegas cocktail waitress, when she falls in with dink, a sports gambler. sparks fly as she proves to be something of a gambling prodigy--much to the ire of dink's wife, tulip.","stephen frears","rebecca hall, bruce willis, vince vaughn, catherine zeta-jones",9541,NA
"95",95,"maniac",2012,"not rated",89,"horror",6.1,"47","as he helps a young artist with her upcoming exhibition, the owner of a mannequin shop's deadly, suppressed desires come to the surface.","franck khalfoun","elijah wood, nora arnezeder, america olivo, megan duffy",29919,NA
"96",96,"the campaign",2012,"r",85,"comedy",6.1,"50","an incumbent congressman embroiled in personal scandal faces a no-holds-barred challenge from a naive newcomer funded by two unscrupulous billionaire lobbyist brothers.","jay roach","will ferrell, zach galifianakis, jason sudeikis, dylan mcdermott",112540,NA
"97",97,"arbitrage",2012,"r",107,"drama, thriller",6.6,"73","a troubled hedge fund magnate desperate to complete the sale of his trading empire makes an error that forces him to turn to an unlikely person for help.","nicholas jarecki","richard gere, susan sarandon, brit marling, tim roth",44427,NA
"98",98,"journey 2: the mysterious island",2012,"pg",94,"action, adventure, comedy",5.8,"41","sean anderson partners with his mom's husband on a mission to find his grandfather, who is thought to be missing on a mythical island.","brad peyton","josh hutcherson, dwayne johnson, michael caine, luis guzmán",74156,NA
"99",99,"safe house",2012,"r",115,"action, crime, mystery",6.8,"52","a young cia agent is tasked with looking after a fugitive in a safe house. but when the safe house is attacked, he finds himself on the run with his charge.","daniel espinosa","denzel washington, ryan reynolds, robert patrick, vera farmiga",178489,NA
"100",100,"rust and bone",2012,"r",120,"drama, romance",7.5,"73","put in charge of his young son, alain leaves belgium for antibes to live with his sister and her husband as a family. alain's bond with stephanie, a killer whale trainer, grows deeper after stephanie suffers a horrible accident.","jacques audiard","marion cotillard, matthias schoenaerts, armand verdure, céline sallette",54198,NA
