"","rank","title","release_year","rating","runtime","genres","movie_rating","metascore","description","directors","actors","votes","gross_in_millions"
"86",86,"freejack",1992,"r",110,"action, crime, sci-fi",5.3,NA,"bounty hunters from the future transport a doomed race car driver to new york city in 2009, where his mind will be replaced with that of a dead billionaire.","geoff murphy","emilio estevez, mick jagger, rene russo, anthony hopkins",12949,NA
"87",87,"hard boiled",1992,"r",128,"action, crime, drama",7.9,NA,"a tough-as-nails cop teams up with an undercover agent to shut down a sinister mobster and his crew.","john woo","yun-fat chow, tony chiu-wai leung, teresa mo, philip chan",40870,NA
"88",88,"wuthering heights",1992,"pg",105,"drama, history, romance",6.9,NA,"a man becomes obsessed with vengeance when his soul mate marries another man.","peter kosminsky","juliette binoche, ralph fiennes, janet mcteer, sophie ward",10372,NA
"89",89,"innocent blood",1992,"r",112,"action, comedy, crime",6.2,NA,"marie is a vampire with a thirst for bad guys. when she fails to properly dispose of one of her victims, a violent mob boss, she bites off more than she can chew and faces a new, immortal danger.","john landis","anne parillaud, anthony lapaglia, robert loggia, david proval",7914,NA
"90",90,"sidekicks",1992,"pg",101,"action, adventure, comedy",4.9,NA,"a bullied teen who fantasizes about being chuck norris' sidekick trains in martial arts to fulfill his dreams.","aaron norris","chuck norris, beau bridges, jonathan brandis, mako",6820,NA
"91",91,"split second",1992,"r",90,"action, crime, horror",6.2,NA,"in a flooded dystopian future london, detective harley stone hunts a serial killer who murdered his partner and has haunted him ever since. he soon discovers what he is hunting might not be human.","tony maylam","rutger hauer, kim cattrall, alastair duncan, michael j. pollard",9181,NA
"92",92,"children of the corn ii: the final sacrifice",1992,"r",92,"horror, thriller",4.2,"18","a journalist and his son travel to nebraska to investigate the mysterious town of gaitlin where, unbeknownst to them, a murderous cult of children are waiting in the corn fields.","david price","terence knox, paul scherrer, ryan bollman, christie clark",6371,NA
"93",93,"medicine man",1992,"pg-13",106,"adventure, drama, romance",6,NA,"an eccentric scientist working for a large drug company is working on a research project in the amazon jungle. he sends for a research assistant and a gas chromatograph because he's close ...                see full summary »","john mctiernan","sean connery, lorraine bracco, josé wilker, rodolfo de alexandre",18537,NA
"94",94,"love potion no. 9",1992,"pg-13",92,"comedy, fantasy, romance",5.6,NA,"two scientists who are hopeless with the opposite sex experiment with a substance that makes them irresistible to anyone who hears them speak.","dale launer","tate donovan, sandra bullock, mary mara, dale midkiff",11130,NA
"95",95,"raising cain",1992,"r",91,"crime, drama, horror",6,NA,"the oncologist wife of a prominent child psychologist suspects her husband has an unhealthy scientific obsession with their child, unaware of what - or who - is really going on inside his head.","brian de palma","john lithgow, lolita davidovich, steven bauer, frances sternhagen",11066,NA
"96",96,"lorenzo's oil",1992,"pg-13",129,"drama",7.2,"80","a boy develops a disease so rare that nobody is working on a cure, so his father decides to learn all about it and tackle the problem himself.","george miller","nick nolte, susan sarandon, peter ustinov, kathleen wilhoite",17583,NA
"97",97,"stop! or my mom will shoot",1992,"pg-13",87,"action, comedy, family",4.1,NA,"a tough police sergeant's overbearing mother comes to visit him and begins to meddle in his life and career.","roger spottiswoode","sylvester stallone, estelle getty, jobeth williams, roger rees",33732,NA
"98",98,"honeymoon in vegas",1992,"pg-13",96,"comedy, romance, thriller",5.8,NA,"on her deathbed, a mother makes her son promise never to get married, which scars him with psychological blocks to a commitment with his girlfriend. they finally decide to tie the knot in ...                see full summary »","andrew bergman","james caan, nicolas cage, sarah jessica parker, pat morita",15114,NA
"99",99,"rapid fire",1992,"r",95,"action, crime, drama",6.3,NA,"when student jake lo witnesses a killing, he finds himself caught between two feuding drug lords. betrayed and set up by the federal agents protecting him, the only one he can trust is ryan...                see full summary »","dwight h. little","brandon lee, powers boothe, nick mancuso, raymond j. barry",6832,NA
"100",100,"pure country",1992,"pg",112,"drama, music, romance",6.9,NA,"dusty gets tired of all the smoke and light effects, wonders what happened to doing it the way that made him famous and happy. takes a walk to find what seems to be missing and finds himself and his music again!","christopher cain","george strait, lesley ann warren, isabel glasser, kyle chandler",3087,NA
