"","rank","title","release_year","rating","runtime","genres","movie_rating","metascore","description","directors","actors","votes","gross_in_millions"
"85",85,"planet of dinosaurs",1977,"pg",84,"sci-fi, drama",4.1,NA,"a space-ship gets lost and is forced to make an emergency landing on an unknown planet. the planet looks much like earth, only with no trace of civilization. soon the crew discovers that ...                see full summary »","james k. shea","mary appleseth, harvey shain, derna wylde, max thayer",1046,NA
"86",86,"the last wave",1977,"pg",106,"drama, fantasy, mystery",7.2,"85","a sydney lawyer defends five aborigines in a ritualized taboo murder and in the process learns disturbing things about himself and premonitions.","peter weir","richard chamberlain, olivia hamnett, david gulpilil, frederick parslow",7060,NA
"87",87,"tentacles",1977,"pg",102,"horror, sci-fi, thriller",3.6,NA,"a mutated giant octopus wreaks havoc on a california seaside community.","ovidio g. assonitis","john huston, shelley winters, bo hopkins, henry fonda",2329,NA
"88",88,"alucarda",1977,"r",78,"horror, thriller",6.3,NA,"after the death of her parents, a young girl arrives at a convent and brings a sinister presence with her. is it her enigmatic imaginary friend, alucarda, who is to blame? or is there a satanic force at work?","juan lópez moctezuma","claudio brook, david silva, tina romero, susana kamini",2128,NA
"89",89,"chatterbox!",1977,"r",73,"comedy, fantasy",5.2,NA,"a young woman who works in a beauty parlor discovers that her vagina can talk, which causes her no end of trouble.","tom desimone","candice rialson, larry gelman, jane kean, perry bullington",393,NA
"90",90,"crossed swords",1977,"pg",113,"adventure, comedy, drama",6.6,NA,"a poor boy and the prince of wales exchange identities, but events force the pair to experience each other's lives as well.","richard fleischer","oliver reed, raquel welch, mark lester, ernest borgnine",1295,NA
"91",91,"herbie goes to monte carlo",1977,"g",105,"action, adventure, comedy",5.5,NA,"herbie, the volkswagen beetle with a mind of its own, is racing in the monte carlo rally. unbeknownst to herbie's driver, thieves have hidden a cache of stolen diamonds in herbie's gas tank, and are now trying to get them back.","vincent mceveety","dean jones, don knotts, julie sommars, jacques marin",5571,NA
"92",92,"erosu gakuen: kando batsugun",1977,NA,66,"comedy",5.7,NA,"a shady male student transfers into a high school full of nubile young schoolgirls. he has his way with most of the female student body on his way to his real conquest--the sexy athletic ...                see full summary »","koretsugu kurahara","asami ogawa, asami morikawa, jun aki, tatsuya hamaguchi",66,NA
"93",93,"beyond the door ii",1977,"r",93,"horror",6.3,NA,"a couple is terrorized in their new house haunted by the vengeful ghost of the woman's former husband who possesses her young son.","mario bava","daria nicolodi, john steiner, david colin jr., ivan rassimov",2533,NA
"94",94,"ilsa the tigress of siberia",1977,"r",85,"horror",4.9,NA,"in 1953, nestled deep in the unforgiving siberian tundra, the stalinist gulag 14 is a purgatory under the command of the brutally seductive tormentor, ilsa. more than two decades later, the camp's sole survivor thirsts for retribution.","jean lafleur","dyanne thorne, michel-rené labelle, gilbert beaumont, jean-guy latour",1352,NA
"95",95,"the glitterball",1977,NA,56,"adventure, family, sci-fi",6.2,NA,"two teenage boys try to help a tiny spherical alien get back to its mothership, while the army and a devious petty crook pursue the creature for its wonderful powers.","harley cokeliss","ben buckton, keith jayne, ron pember, marjorie yates",164,NA
"96",96,"death game",1977,"r",91,"thriller",5.2,NA,"two young girls come to the home of a businessman whose family is away on his birthday. they seduce him and afterwards, however, they tie him up, torture him and trash his house.","peter s. traynor","sondra locke, colleen camp, seymour cassel, beth brickell",583,NA
"97",97,"heroes",1977,"pg",112,"comedy, drama",6,"35","a vietnam veteran suffering from post traumatic stress disorder breaks out of a va hospital and goes on a road trip with a sympathetic traveler to find out what became of the other men in his unit.","jeremy kagan","henry winkler, sally field, harrison ford, val avery",1342,NA
"98",98,"rituals",1977,"r",100,"adventure, horror, thriller",6.5,NA,"five doctors on a wilderness outing are stalked by disfigured, crazed killers.","peter carter","hal holbrook, lawrence dane, robin gammell, ken james",1265,NA
"99",99,"the ascent",1977,NA,111,"drama, war",8.3,NA,"in a freezing cold world war ii winter, two pro-soviet partisans - sotnikov and rybak - head off to find food for themselves and their compatriots. they find a goat at the home of a german ...                see full summary »","larisa shepitko","boris plotnikov, vladimir gostyukhin, sergey yakovlev, lyudmila polyakova",4385,NA
"100",100,"semi-tough",1977,"r",108,"comedy, romance, sport",5.9,NA,"a three-way friendship between two free-spirited professional football players and the owner's daughter becomes compromised when two of them become romantically involved.","michael ritchie","burt reynolds, kris kristofferson, jill clayburgh, robert preston",2054,NA
