"","rank","title","release_year","rating","runtime","genres","movie_rating","metascore","description","directors","actors","votes","gross_in_millions"
"84",84,"99 women",1969,"unrated",86,"crime, drama",4.8,NA,"new inmate marie arrives at an island prison in the women's sector and receives the number 99. the inmates are controlled by the sadistic lesbian warden thelma diaz and governor santos and ...                see full summary »","jesús franco","maria schell, luciana paluzzi, mercedes mccambridge, herbert lom",1028,NA
"85",85,"the april fools",1969,"m",95,"comedy, drama, romance",6.4,NA,"in new york, the newly-promoted wall street broker, howard brubaker is invited by his boss ted gunther, to come to his apartment. however, there is a party and howard feels uncomfortable ...                see full summary »","stuart rosenberg","jack lemmon, catherine deneuve, peter lawford, jack weston",890,NA
"86",86,"charro!",1969,"g",98,"western",5.7,NA,"jess wade is falsely accused of having stolen a cannon from the mexican revolutionary forces. he tries to find the real culprits, a gang of criminals.","charles marquis warren","elvis presley, ina balin, victor french, barbara werle",1303,NA
"87",87,"putney swope",1969,"r",84,"comedy",7,NA,"dark satire in which the token black man on the executive board of an advertising firm is accidentally put in charge. renaming the business ""truth and soul, inc."", he replaces the tight ...                see full summary »","robert downey sr.","arnold johnson, stan gottlieb, allen garfield, archie russell",2221,NA
"88",88,"12 + 1",1969,"r",94,"adventure, comedy",6,NA,"mario, a young philanderer, receives 13 antique chairs in a bad state by inheritance and decides to sell off them to get some money. afterwards he gets to know that one of them contains ...                see full summary »","nicolas gessner, luciano lucignani","sharon tate, vittorio gassman, orson welles, vittorio de sica",310,NA
"89",89,"john and mary",1969,"r",92,"drama, romance",6.6,NA,"john and mary meet in a singles bar, sleep together, and spend the next day getting to know each other.","peter yates","dustin hoffman, mia farrow, michael tolan, sunny griffin",1640,NA
"90",90,"rio 70",1969,"not rated",94,"action, adventure",4.6,NA,"sumuru, the beautiful leader of the all-female kingdom of femina, plans to use her women to take over the world.","jesús franco","shirley eaton, richard wyler, george sanders, maria rohm",578,NA
"91",91,"what ever happened to aunt alice?",1969,"m",101,"crime, drama, mystery",7.1,NA,"as aunt alice, ruth gordon applies for the job of housekeeper in the tucson, arizona home of widow claire marrable in order to find out what happened to a missing widowed friend, edna ...                see full summary »","lee h. katzin, bernard girard","geraldine page, ruth gordon, rosemary forsyth, robert fuller",1550,NA
"92",92,"downhill racer",1969,"m",101,"drama, sport",6.5,"90","quietly cocky robert redford joins u.s. ski team as downhill racer and clashes with the team's coach, played by gene hackman. lots of good skiing action leading to an exciting climax.","michael ritchie","robert redford, gene hackman, camilla sparv, karl michael vogler",3324,NA
"93",93,"funeral parade of roses",1969,NA,107,"drama",8.2,NA,"the trials and tribulations of eddie and other transvestites in japan.","toshio matsumoto","pîtâ, osamu ogasawara, yoshimi jô, koichi nakamura",2835,NA
"94",94,"psychout for murder",1969,"r",88,"drama, horror, thriller",6.3,NA,"mario consigns his girlfriend licia to a whorehouse for an evening in order to get the photographic goods to blackmail her father with. to get her out of the way, licia is then consigned to a mental hospital by her father.","rossano brazzi","adrienne larussa, rossano brazzi, nino castelnuovo, paola pitagora",120,NA
"95",95,"the gay deceivers",1969,"r",97,"comedy",5.8,NA,"danny and elliot avoid military service by pretending to be gay, but they have to act the part when the recruiting officer doesn't buy it.","bruce kessler","kevin coughlin, brooke bundy, lawrence p. casey, jo ann harris",283,NA
"96",96,"last summer",1969,"r",95,"drama",7.1,NA,"during summer vacation on fire island, three young people--a girl and two guys--become so close that they form a sort-of threesome. when an uncool girl tries to infiltrate the trio's newly ...                see full summary »","frank perry","barbara hershey, richard thomas, bruce davison, catherine burns",1319,NA
"97",97,"my side of the mountain",1969,"g",100,"adventure, family",6.7,NA,"as young sam gribley runs away he learns about nature.","james b. clark","ted eccles, theodore bikel, tudi wiggins, paul hébert",797,NA
"98",98,"the milky way",1969,"m",105,"comedy, drama",7.7,NA,"two drifters go on a pilgrimage from france to santiago de compostela in spain. along the way, they hitchhike, beg for food, and face the christian dogmas and heresies from different ages.","luis buñuel","paul frankeur, laurent terzieff, alain cuny, edith scob",5369,NA
"99",99,"nerosubianco",1969,"x",77,"comedy",5.7,NA,"a taboo-smasher of the late '60s, featuring interracial affairs, anti-vietnam statements, violence versus sex. take a whirlwind trip with a married woman whose journey through the ...                see full summary »","tinto brass","anita sanders, terry carter, nino segurini, umberto di grazia",198,NA
"100",100,"the trouble with girls",1969,"g",97,"comedy, musical",5.5,NA,"chautauqua manager walter hale and his loyal business manager struggle to keep their traveling troupe together in small town america.","peter tewksbury","elvis presley, marlyn mason, nicole jaffe, sheree north",1112,NA
