"","rank","title","release_year","rating","runtime","genres","movie_rating","metascore","description","directors","actors","votes","gross_in_millions"
"1",1,"the general",1926,"unrated",67,"action, adventure, comedy",8.2,NA,"when union spies steal an engineer's beloved locomotive, he pursues it single-handedly and straight through enemy lines.","clyde bruckman, buster keaton","buster keaton, marion mack, glen cavender, jim farley",60243,NA
"2",2,"faust",1926,"not rated",85,"drama, fantasy, horror",8.1,NA,"the demon mephisto wagers with god that he can corrupt a mortal man's soul.","f.w. murnau","gösta ekman, emil jannings, camilla horn, frida richard",11498,NA
"3",3,"the son of the sheik",1926,"passed",68,"adventure, drama, romance",7.4,NA,"the son of the sheik and a dancing girl fall in love, but when he is made to believe she has betrayed him he seeks revenge.","george fitzmaurice","rudolph valentino, vilma bánky, george fawcett, montagu love",1514,NA
"4",4,"flesh and the devil",1926,"not rated",112,"drama, romance",8.1,NA,"childhood friends are torn apart when one of them marries the woman the other once fiercely loved.","clarence brown","john gilbert, greta garbo, lars hanson, barbara kent",3435,NA
"5",5,"the great gatsby",1926,"passed",80,NA,NA,NA,NA,"herbert brenon",NA,NA,NA
"6",6,"die abenteuer des prinzen achmed",1926,"not rated",81,"animation, adventure, fantasy",7.9,NA,"a handsome prince rides a flying horse to far-away lands and embarks on magical adventures, which include befriending a witch, meeting aladdin, battling demons and falling in love with a princess.",NA,NA,4084,NA
"7",7,"kurutta ippêji",1926,NA,70,"drama, horror",7.6,NA,"a man takes a job at an asylum with hopes of freeing his imprisoned wife.","teinosuke kinugasa","masuo inoue, ayako iijima, yoshie nakagawa, hiroshi nemoto",1785,NA
"8",8,"the scarlet letter",1926,"passed",115,"drama",7.8,NA,"after having a child out of wedlock, a young puritan woman is pressured to reveal the name of her lover.","victor sjöström","lillian gish, lars hanson, henry b. walthall, karl dane",1231,NA
"9",9,"the temptress",1926,"passed",117,"drama, romance",7.1,NA,"an architect tries suppressing his passion for a seductive woman.","fred niblo, mauritz stiller","greta garbo, antonio moreno, marc mcdermott, lionel barrymore",883,NA
"10",10,"mother",1926,NA,89,"drama",7.7,NA,"the film version of gorki's great story of the 1905 revolution","vsevolod pudovkin","vera baranovskaya, nikolay batalov, aleksandr chistyakov, anna zemtsova",1941,NA
"11",11,"the black pirate",1926,NA,88,"adventure, action",7.2,NA,"seeking revenge, an athletic young man joins the pirate band responsible for his father's death.","albert parker","douglas fairbanks, billie dove, tempe pigott, donald crisp",1384,NA
"12",12,"the bat",1926,NA,86,"mystery, thriller",6.7,NA,"a masked criminal who dresses like a giant bat terrorizes the guests at an old house rented by a mystery writer.","roland west","george beranger, charles herzinger, emily fitzroy, louise fazenda",593,NA
"13",13,"the mountain eagle",1926,NA,57,NA,NA,NA,NA,"alfred hitchcock",NA,NA,NA
"14",14,"3 bad men",1926,"unrated",122,"romance, western",7.6,NA,"three outlaws come to the aid of a young girl after her father is killed.","john ford","george o'brien, olive borden, lou tellegen, tom santschi",757,NA
"15",15,"torrent",1926,"passed",88,"drama, romance",7.1,NA,"a young girl and her father are kicked out of their house by a cruel noblewoman, and the girl's heart is broken when her sweetheart, the noblewoman's son, won't go to paris with them. after...                see full summary »","monta bell","ricardo cortez, greta garbo, gertrude olmstead, edward connelly",567,NA
"16",16,"la bohème",1926,"passed",95,"drama, romance",7.9,NA,"a group of starving artists try to survive in 1830s paris, including a seamstress and the would-be playwright she loves.","king vidor","lillian gish, john gilbert, renée adorée, george hassell",1213,NA
"17",17,"brown of harvard",1926,"not rated",85,"drama, romance",8.3,NA,"tom brown shows up at harvard, confident and a bit arrogant. he becomes a rival of bob mcandrew, not only in football and rowing crew, but also for the affections of mary abbott, a ...                see full summary »","jack conway","william haines, jack pickford, mary brian, francis x. bushman jr.",1287,NA
"18",18,"battling butler",1926,"not rated",77,"comedy",7.2,NA,"a love-struck weakling must pretend to be boxer in order to gain respect from the family of the girl he loves.","buster keaton","buster keaton, snitz edwards, sally o'neil, walter james",1994,NA
"19",19,"don juan",1926,"passed",110,"adventure, romance",7.1,NA,"in 16th century italy, devil-may-care playboy don juan runs afoul of the despotic borgias.","alan crosland","jane winton, john roche, warner oland, estelle taylor",591,NA
"20",20,"sparrows",1926,"unrated",110,"drama",7.5,NA,"molly, the eldest child at a baby farm hidden deep in a swamp, must rescue the others when their cruel master decides that one of them will be disposed of.","william beaudine, tom mcnamara","mary pickford, roy stewart, mary louise miller, gustav von seyffertitz",983,NA
"21",21,"the man who cheated life",1926,NA,110,"drama, horror",7.2,NA,"for balduin, going out to beer parties with his fellow students and fighting out disputes at the tip of the sword have lost their charms. he wants to find love; but how would he, a ...                see full summary »","henrik galeen","conrad veidt, elizza la porta, fritz alberti, ágnes eszterházy",455,NA
"22",22,"what price glory",1926,NA,116,"comedy, drama, war",7.2,NA,"u.s. marine sergeants quirt and flagg are inveterate romantic rivals on peacetime assignments in china and the philippines. in 1917, w.w. i brings them to france, where flagg, now a captain...                see full summary »","raoul walsh","victor mclaglen, edmund lowe, dolores del rio, william v. mong",309,NA
"23",23,"tell it to the marines",1926,"passed",103,"comedy, drama, romance",7.9,NA,"a gruff marine sergeant and a handsome new recruit compete for the affection of a nurse.","george w. hill","lon chaney, william haines, eleanor boardman, eddie gribbon",1299,NA
"24",24,"the winning of barbara worth",1926,NA,89,"drama, romance, western",7.5,NA,"while building an irrigation system for a southwestern desert community, an engineer vies with a local cowboy for the affections of a rancher's daughter.","henry king","ronald colman, vilma bánky, gary cooper, charles lane",548,NA
"25",25,"secrets of a soul",1926,"not rated",97,"drama",7,NA,"a scientist is tormented by an irrational fear of knives and the irresistible compulsion to murder his wife.","georg wilhelm pabst","werner krauss, ruth weyher, ilka grüning, jack trevor",498,NA
"26",26,"beau geste",1926,NA,101,"action, adventure, drama",7,NA,"michael ""beau"" geste leaves england in disgrace and joins the infamous french foreign legion. he is reunited with his two brothers in north africa, where they face greater danger from their...                see full summary »","herbert brenon","ronald colman, neil hamilton, ralph forbes, alice joyce",275,NA
"27",27,"the great k & a train robbery",1926,NA,53,"western",6.5,NA,"cullen has hired tom to try and stop the robberies on his railroad. knowing cullen's secretary holt is tipping off the gang, tom works undercover by posing as a highwayman. to help him ...                see full summary »","lewis seiler","tom mix, dorothy dwan, tony the horse, will walling",192,NA
"28",28,"po zakonu",1926,NA,80,"drama",7.9,NA,"a five-person team of gold prospectors in the yukon has just begun to enjoy great success when one of the members snaps, and suddenly kills two of the others. the two survivors, a husband ...                see full summary »","lev kuleshov","aleksandra khokhlova, sergey komarov, vladimir fogel, pyotr galadzhev",663,NA
"29",29,"bardelys the magnificent",1926,"passed",90,"drama, romance",7.9,NA,"rafael sabatini's story of the swashbuckling era and of bardeleys, the handsome courtier who could win any woman he set his mind to...and was not above boasting about it to all who would listen.","king vidor","john gilbert, eleanor boardman, roy d'arcy, lionel belmore",871,NA
"30",30,"der heilige berg",1926,NA,100,"drama",6.8,NA,"the dancer, diotima, meets an engineer and skier, karl, in his cottage in the mountains where they fall in love and have an affair. when karl's young friend, vigo, meets her she gives him ...                see full summary »","arnold fanck","leni riefenstahl, luis trenker, ernst petersen, frida richard",504,NA
"31",31,"the magician",1926,"passed",83,"drama, fantasy, horror",6.8,NA,"a magician/alchemist, seeking to create life, finds that he needs the ""blood of a virgin"" to continue his experiments. he sends out his dwarf assistant to pick out the right girl.","rex ingram","alice terry, paul wegener, firmin gémier, iván petrovich",404,NA
"32",32,"nana",1926,"not rated",150,"drama, romance",6.9,NA,"when the vivacious and beautiful nana bombs at the théâtre des variétés, she embarks on the life of a courtesan, using her allure and charisma to entice and pleasure men.","jean renoir","catherine hessling, pierre lestringuez, jacqueline forzane, werner krauss",575,NA
"33",33,"the boob",1926,"passed",64,"comedy, romance",4.8,NA,"idealistic farm boy peter loves amy whose fancy is urbane harry. he discovers harry is a rum runner and turns him over to prohibition agents, including jane. may is at last impressed with ...                see full summary »","william a. wellman","gertrude olmstead, george k. arthur, joan crawford, charles murray",357,NA
"34",34,"beverly of graustark                                70 min             |             comedy, romance                                        8.2                                                                        rate this                              1      2      3      4      5      6      7      8      9      108.2/10x                     beverly of graustark",1926,NA,70,"comedy, romance",8.2,NA,"beverly of graustark (1926) is a silent film directed by sidney franklin, starring marion davies, antonio moreno and creighton hale. the film's screenplay was written by agnes christine ...                see full summary »","sidney franklin","marion davies, antonio moreno, creighton hale, roy d'arcy",342,NA
"35",35,"glomdalsbruden",1926,NA,115,"drama, romance",6.8,NA,"tore takes over the rundown family farm. applying his youthful energy, he intends to make it into a big farm like glomgården on the other side of the river, where beautiful berit loves. ...                see full summary »","carl theodor dreyer","einar sissener, tove tellback, stub wiberg, harald stormoen",310,NA
"36",36,"the strong man",1926,NA,75,"comedy",6.8,NA,"a meek belgian soldier (harry langdon) fighting in world war i receives penpal letters and a photo from ""mary brown"", an american girl he has never met. he becomes infatuated with her by ...                see full summary »","frank capra","harry langdon, priscilla bonner, gertrude astor, william v. mong",629,NA
"37",37,"the bells",1926,NA,68,"crime, drama, horror",6.6,NA,"an innkeeper murders a wealthy guest to pay off his debt, but his conscience will not allow him to get away with the crime so easily.","james young","lionel barrymore, caroline frances cooke, gustav von seyffertitz, lorimer johnston",279,NA
"38",38,"the sorrows of satan",1926,"passed",90,"drama, romance",7.4,NA,"geoffrey, a young and impoverished writer, is desperately in love with mavis, who lives at his boardinghouse and is also pursuing a writing career. unable to marry her because of his ...                see full summary »","d.w. griffith","adolphe menjou, ricardo cortez, carol dempster, lya de putti",163,NA
"39",39,"the volga boatman",1926,NA,120,"drama, romance",6.7,NA,"during the revolution princess vera, though betrothed to prince dimitri, is attracted to the peasant feodor.","cecil b. demille","william boyd, elinor fair, robert edeson, victor varconi",94,NA
"40",40,"the devil's circus",1926,NA,70,"drama",6.9,NA,"the devil's circus is a 1926 silent drama film directed by danish benjamin christensen, based upon his screenplay. the film stars norma shearer and charles emmett mack. it was the ...                see full summary »","benjamin christensen","norma shearer, charles emmett mack, carmel myers, john miljan",71,NA
"41",41,"l'ultimo lord",1926,NA,NA,NA,NA,NA,"an american boy turns out to be the long-lost heir of a british fortune. he is sent to live with the cold and unsentimental lord who oversees the trust.","augusto genina",NA,NA,NA
"42",42,"kiki",1926,NA,108,"comedy",7.4,NA,"kiki, a poor young woman who sells newspapers on the street corners of paris, is able to land a job singing and dancing at a nearby theater. while she is there, she invites herself into the...                see full summary »","clarence brown","norma talmadge, ronald colman, gertrude astor, marc mcdermott",376,NA
"43",43,"the flying ace",1926,NA,65,"adventure, crime, war",6.4,NA,"a veteran world war i fighter pilot returns home a war hero and immediately regains his former job as a railroad company detective. his first case: recover a stolen satchel filled with ...                see full summary »","richard e. norman","laurence criner, kathryn boyd, boise de legge, harold platts",41,NA
"44",44,"old ironsides",1926,NA,111,"drama, history",7.1,NA,"an american fighting ship battles barbary pirates in the mediterranean in the 18th century.","james cruze","charles farrell, esther ralston, wallace beery, george bancroft",113,NA
"45",45,"mantrap",1926,"passed",86,"comedy",7.1,NA,"a sexy young manicurist living with her older backwoodsman husband in a small canadian town finds herself attracted to a young, rich and famous divorce lawyer who comes to town on vacation.","victor fleming","ernest torrence, clara bow, percy marmont, eugene pallette",252,NA
"46",46,"the blackbird",1926,"not rated",86,"crime, drama, romance",6.9,NA,"two thieves, the blackbird and west end bertie, fall in love with the same girl, a french nightclub performer named fifi. each man tries to outdo the other to win her heart.","tod browning","lon chaney, owen moore, renée adorée, doris lloyd",546,NA
"47",47,"the johnstown flood",1926,NA,60,"drama",4.7,NA,"johnstown flood tells a true story of heartbreak, heroism and the courage to survive. on a stormy day in may of 1889, the south fork dam explodes, unleashing a 40-foot wall of water. ...                see full summary »","irving cummings","george o'brien, florence gilbert, janet gaynor, anders randolf",28,NA
"48",48,"the greater glory",1926,"passed",110,"drama, romance, war",7.1,NA,"a story of vienna following world war i, in which the butchers became millionaires and the aristocrats became beggars, told against a background of mother-love and sacrifice.","curt rehfeld","conway tearle, anna q. nilsson, may allison, ian keith",7,NA
"49",49,"kid boots",1926,"passed",77,"comedy, romance",7,NA,"a salesman is helped out of a jam with an angry customer by a wealthy playboy. in return, he agrees to help the playboy get a divorce from his wife, only to find himself falling for the ...                see full summary »","frank tuttle","eddie cantor, clara bow, billie dove, lawrence gray",100,NA
"50",50,"bhagwa zenda",1926,NA,NA,NA,NA,NA,"add a plot",NA,NA,NA,NA
"51",51,"it's the old army game",1926,"passed",77,"adventure, comedy, romance",7,NA,"druggist elmer prettywillie is sleeping. a woman rings the night bell only to buy a two-cent stamp. then garbage collectors waken him. next it's firemen on a false alarm. and then a real fire.","a. edward sutherland","w.c. fields, louise brooks, blanche ring, william gaxton",167,NA
"52",52,"for heaven's sake",1926,"passed",58,"action, comedy, romance",7.6,NA,"an irresponsible young millionaire changes his tune when he falls for the daughter of a downtown minister.","sam taylor","harold lloyd, jobyna ralston, noah young, jim mason",1100,NA
"53",53,"the road to mandalay",1926,NA,70,"drama",6.8,NA,"a former captain tries to reunite with his daughter, twenty years after leaving her as an infant.","tod browning","lon chaney, lois moran, owen moore, henry b. walthall",134,NA
"54",54,"aloma of the south seas",1926,NA,90,"comedy, drama",5.9,NA,"young south seas native boy is sent to the u.s. for his education, returns to his island after his father dies to try to stop a revolution.","maurice tourneur","gilda gray, percy marmont, warner baxter, william powell",8,NA
"55",55,"a woman of the sea",1926,NA,75,"drama",6.8,NA,"joan and magdalen are the daughters of a fisherman. magdalen leaves her fiancé, peter, to run off to the big city. joan and peter marry. magdalen's return years later causes trouble for the...                see full summary »","josef von sternberg","edna purviance, raymond bloomer, charles k. french, eve southern",32,NA
"56",56,"the american venus",1926,NA,80,"comedy",7.7,NA,"mary gray, whose father manufactures cold cream, is engaged to sappy horace niles, the son of hugo niles, the elder gray's most competitive rival in the cosmetics business. chip armstrong, ...                see full summary »","frank tuttle","esther ralston, lawrence gray, ford sterling, fay lanphier",18,NA
"57",57,"ella cinders",1926,"passed",75,"comedy, romance",7.9,NA,"poor ella cinders is much abused by her evil step-mother and step-sisters. when she wins a local beauty contest she jumps at the chance to get out of her dead-end life and go to hollywood, ...                see full summary »","alfred e. green","colleen moore, lloyd hughes, vera lewis, doris baker",772,NA
"58",58,"mare nostrum",1926,"passed",102,"drama, war",7,NA,"the story of a female german spy who willingly sacrifices her life for her country.","rex ingram","apollon uni, álex nova, kada-abd-el-kader, hughie mack",245,NA
"59",59,"the country beyond",1926,NA,60,NA,NA,NA,"in the canadian mountains an orphan girl, valencia, is left in the care of the abusive hawkins family. a fugitive outlaw, roger mckay, stumbles onto the property and immediately falls in ...                see full summary »","irving cummings",NA,NA,NA
"60",60,"the show-off",1926,"passed",82,"comedy, drama",6.9,NA,"a blowhard who poses as a railroad executive (but is really just a $30-a-week clerk) catches a young bride and then drives her family's finances to the brink of ruin.","malcolm st. clair","ford sterling, claire mcdowell, charles goodrich, lois wilson",229,NA
"61",61,"the road to glory",1926,NA,93,"drama",7.4,NA,"may mcavoy is a woman who is blinded in an auto accident and relies on prayer to regain her sight.","howard hawks","may mcavoy, leslie fenton, ford sterling, rockliffe fellowes",25,NA
"62",62,"feu mathias pascal",1926,NA,170,"drama",7.1,NA,"mathias pascal, only son of a once rich family, marries beautiful romalinda, who has a terrible mother-in-law. she controls her daughter, and soon his home life becomes a nightmare, as well...                see full summary »","marcel l'herbier","ivan mozzhukhin, marcelle pradot, lois moran, marthe mellot",239,NA
"63",63,"somebody's mother",1926,NA,NA,NA,NA,NA,"""matches mary"" has sold matches on the streets of new york for many years and nobody knows her real identity. the truth is that mary's young son had been kidnapped many years ago and she ...                see full summary »","oscar apfel",NA,NA,NA
"64",64,"the call of the klondike",1926,NA,NA,NA,NA,NA,"a desert prospecter, dick norton, decides to head to the klondike in search of gold. in the klondike, norton becomes a mining engineer whose honesty upsets a crooked mortimer pearson. ...                see full summary »","oscar apfel",NA,NA,NA
"65",65,"shinel",1926,NA,84,"drama",6.8,NA,"one of the most acknowledged film interpretations of classic short story ""the overcoat"" (1842) by nikolai gogol, describing a fate of a ""small person"".","grigori kozintsev, leonid trauberg","antonina eremeeva, emil gal, sergey gerasimov, andrei kapler",212,NA
"66",66,"tramp, tramp, tramp",1926,"passed",62,"adventure, comedy, romance",5.8,NA,"low-life harry falls in love with sweet betty who inspires him to improve himself so he can marry her. he enters a $25,000 cross-country hiking contest. after many adventures he wins, pays ...                see full summary »","harry edwards","harry langdon, joan crawford, edwards davis, tom murray",525,NA
"67",67,"fig leaves",1926,"passed",70,"comedy",6.6,NA,"in the modern day (1920s) story, adam, a plumber, is happily married to eve, a wardrobe-obsessed housewife, until she accidentally meets a supercilious fashion designer. at the prompting of...                see full summary »","howard hawks","george o'brien, olive borden, phyllis haver, george beranger",163,NA
"68",68,"the clinging vine",1926,"passed",71,"comedy",6,NA,"mannish ultra-efficient a.b. is the real force behind the bancroft paint business. but on a weekend house-party when she overhears the boss's grandson (jimmy)'s unflattering opinion of her ...                see full summary »","paul sloane","leatrice joy, tom moore, robert edeson, snitz edwards",89,NA
"69",69,"the sea beast",1926,NA,136,"action, adventure, fantasy",6.6,NA,"this silent movie is based on melville's classic moby dick. ahab and his brother compete for the affections of minister's daughter esther. but the great white whale has been eluding the ...                see full summary »","millard webb","john barrymore, dolores costello, george o'hara, mike donlin",92,NA
"70",70,"so this is paris",1926,NA,80,"comedy",7.4,NA,"the first movie to ever depict a choreographed dance scene in a silent movie. the charleston!","ernst lubitsch","monte blue, patsy ruth miller, lilyan tashman, george beranger",252,NA
"71",71,"paris",1926,NA,67,"drama",2.3,NA,"the power of love in the violent underground world of the apaches in paris in the early 20th century.","edmund goulding","charles ray, joan crawford, douglas gilmore, michael visaroff",84,NA
"72",72,"the border sheriff",1926,NA,NA,NA,NA,NA,"carter brace is out to murder belden. collins who was sent to bring in the border gang led by brace, saves belden's life in san francisco. when they all reach the border, brace tries again.","robert n. bradbury",NA,NA,NA
"73",73,"the last days of pompeii",1926,NA,181,"drama, history",6.3,NA,"add a plot","carmine gallone, amleto palermi","victor varconi, rina de liguoro, maría corda, bernhard goetzke",23,NA
"74",74,"the fire brigade",1926,NA,90,"drama",8.2,NA,"terry o'neill is the youngest of a family of irish firefighters. he falls in love with helen corwin, but complications ensue when terry learns that her father, a wealthy contractor, has cut...                see full summary »","william nigh","may mcavoy, charles ray, holmes herbert, tom o'brien",24,NA
"75",75,"mauprat",1926,NA,88,"drama",6.9,NA,"set before the french revolution, the film tells the story of bernard de mauprat, a noble orphan, raised by despicable aristocrats, who is saved from the gallows by his cousin edmée and his...                see full summary »","jean epstein","sandra milovanoff, maurice schutz, nino constantini, rené ferté",98,NA
"76",76,"upstage",1926,"passed",76,"drama, romance",7,NA,"dolly havens, a small-town girl with big-town ambitions that are larger than her talents, hooks up with johnny storm, a vaudeville performer, whose talents make the act a success. dolly, ...                see full summary »","monta bell","norma shearer, oscar shaw, tenen holtz, gwen lee",50,NA
"77",77,"the shamrock handicap",1926,"passed",66,"romance, drama",5.9,NA,"trovatosi in grosse difficoltà economiche, un vecchio nobiluomo irlandese è costretto a vendere parte della propria scuderia ad un possidente americano, che si porta via anche il suo ...                see full summary »","john ford","janet gaynor, leslie fenton, willard louis, j. farrell macdonald",97,NA
"78",78,"exit smiling",1926,"passed",77,"comedy, romance",7.1,NA,"a maid who works for a traveling theatrical troupe wants desperately to be an actress, and manages to get some small roles in the company's productions, but is determined to do anything she...                see full summary »","sam taylor","beatrice lillie, jack pickford, doris lloyd, dewitt jennings",354,NA
"79",79,"michel strogoff",1926,NA,168,"adventure",7.4,NA,"in 1860s russia, a young officer is sent on a mission to save his country from invaders.","viktor tourjansky","ivan mozzhukhin, nathalie kovanko, acho chakatouny, jeanne brindeau",61,NA
"80",80,"manon lescaut",1926,NA,99,"drama",6.5,NA,"a tragic love story between a french nobleman and a young seducer.","arthur robison","lya de putti, vladimir gajdarov, eduard rothauser, fritz greiner",33,NA
"81",81,"le voyage imaginaire",1926,NA,80,"comedy, drama, fantasy",6.9,NA,"add a plot","rené clair","dolly davis, jean börlin, albert préjean, jim gérald",127,NA
"82",82,"love 'em and leave 'em",1926,"passed",76,"comedy, drama, romance",7,NA,"the tale of two sisters with the older one pledged to look after the younger one that transpires between a department store, nyc's central park and a boarding house. the older one is the ...                see full summary »","frank tuttle","evelyn brent, lawrence gray, louise brooks, osgood perkins",176,NA
"83",83,"carmen",1926,NA,110,"drama",6.8,NA,"carmen has neither a past nor a future. she lives only in the present. for her love is of no importance, just a passing whim. love's essence is precisely the variability that don josé hate ...                see full summary »","jacques feyder","raquel meller, fred louis lerch, gaston modot, jean murat",64,NA
