"","rank","title","release_year","rating","runtime","genres","movie_rating","metascore","description","directors","actors","votes","gross_in_millions"
"1",1,"the adventures of robin hood",1938,"pg",102,"action, adventure, romance",8,"97","when prince john and the norman lords begin oppressing the saxon masses in king richard's absence, a saxon lord fights back as the outlaw leader of a rebel guerrilla army.","michael curtiz, william keighley","errol flynn, olivia de havilland, basil rathbone, claude rains",41065,NA
"2",2,"a christmas carol",1938,"not rated",69,"drama, family, fantasy",7.5,NA,"on christmas eve, an old miser named ebenezer scrooge is visited by the spirit of his former partner, jacob marley. the deceased partner was in his lifetime as mean and miserly as scrooge ...                see full summary »","edwin l. marin","reginald owen, gene lockhart, kathleen lockhart, terry kilburn",4763,NA
"3",3,"vivacious lady",1938,"approved",90,"comedy, romance",7.3,NA,"a professor marries a nightclub singer, much to the consternation of his family and friends back home.","george stevens","ginger rogers, james stewart, james ellison, beulah bondi",2556,NA
"4",4,"bringing up baby",1938,"not rated",102,"comedy, family, romance",8,NA,"while trying to secure a $1 million donation for his museum, a befuddled paleontologist is pursued by a flighty and often irritating heiress and her pet leopard, baby.","howard hawks","katharine hepburn, cary grant, charles ruggles, walter catlett",47687,NA
"5",5,"you can't take it with you",1938,"approved",126,"comedy, drama, romance",8,NA,"a man from a family of rich snobs becomes engaged to a woman from a good-natured but decidedly eccentric family.","frank capra","jean arthur, james stewart, lionel barrymore, edward arnold",19286,NA
"6",6,"the lady vanishes",1938,"not rated",96,"mystery, thriller",7.9,NA,"while traveling in continental europe, a rich young playgirl realizes that an elderly lady seems to have disappeared from the train.","alfred hitchcock","margaret lockwood, michael redgrave, paul lukas, may whitty",38946,NA
"7",7,"dramatic school",1938,"passed",80,"drama, romance",6.3,NA,"aspiring actress louise muban attends the prestigious paris school of drama during the day and works at a dreary factory assembling gas meters at night. she daydreams and ""acts"" her way ...                see full summary »","robert b. sinclair","luise rainer, paulette goddard, alan marshal, lana turner",276,NA
"8",8,"angels with dirty faces",1938,"approved",97,"crime, drama, film-noir",8,NA,"a priest tries to stop a gangster from corrupting a group of street kids.","michael curtiz","james cagney, pat o'brien, humphrey bogart, ann sheridan",17039,NA
"9",9,"jezebel",1938,"approved",104,"drama, romance",7.6,NA,"in 1850s louisiana, a free-spirited southern belle loses her fiancé due to her stubborn vanity and pride, and vows to win him back.","william wyler","bette davis, henry fonda, george brent, margaret lindsay",9672,NA
"10",10,"holiday",1938,"approved",95,"comedy, romance",7.9,NA,"a young man falls in love with a girl from a rich family. his unorthodox plan to go on holiday for the early years of his life is met with skepticism by everyone except for his fiancée's eccentric sister and long-suffering brother.","george cukor","katharine hepburn, cary grant, doris nolan, lew ayres",11684,NA
"11",11,"pygmalion",1938,"not rated",89,"comedy, drama, romance",7.9,NA,"a victorian dialect expert makes a bet that he can teach a cockney flower girl to speak proper english and pass as a lady in high society.","anthony asquith, leslie howard","leslie howard, wendy hiller, wilfrid lawson, marie lohr",6424,NA
"12",12,"blondie",1938,"approved",70,"comedy, family",7.1,NA,"in this first of the blondie series, dagwood loses his job on the eve of his and blondie's fifth wedding anniversary.","frank r. strayer","penny singleton, arthur lake, larry simms, daisy",382,NA
"13",13,"boys town",1938,"passed",96,"biography, drama",7.3,NA,"against all odds father flanagan starts ""boys' town"" after hearing a convict's story. whitey marsh comes there. he runs away but, hungry, returns. he runs away again but, when friend pee ...                see full summary »","norman taurog","spencer tracy, mickey rooney, henry hull, leslie fenton",4324,NA
"14",14,"listen, darling",1938,"passed",75,"comedy, drama, family",6.6,NA,"to stop pinkie's mother dottie from marrying a man they know she does not love, pinkie and her friend buzz kidnap her in the family trailer to live a life on the open road without worries ...                see full summary »","edwin l. marin","judy garland, freddie bartholomew, mary astor, walter pidgeon",432,NA
"15",15,"la bête humaine",1938,"not rated",100,"crime, drama",7.7,NA,"in this classic adaptation of emile zola's novel, a tortured train engineer falls in love with a troubled married woman who has helped her husband commit a murder.","jean renoir","jean gabin, julien carette, simone simon, fernand ledoux",5488,NA
"16",16,"alexander nevsky",1938,"not rated",112,"action, biography, drama",7.7,NA,"the story of how a great russian prince led a ragtag army to battle an invading force of teutonic knights.","sergei m. eisenstein, dmitriy vasilev","nikolay cherkasov, nikolai okhlopkov, andrei abrikosov, dmitriy orlov",8826,NA
"17",17,"the amazing dr. clitterhouse",1938,"approved",87,"crime, drama",7,NA,"black comedy about a brilliant park avenue doctor who becomes a criminal in order to do research into the criminal mind.","anatole litvak","edward g. robinson, humphrey bogart, claire trevor, allen jenkins",1865,NA
"18",18,"marie antoinette",1938,"passed",149,"biography, drama, history",7.6,NA,"the tragic life of marie antoinette, who became queen of france in her late teens.","w.s. van dyke, julien duvivier","norma shearer, tyrone power, john barrymore, robert morley",2257,NA
"19",19,"the citadel",1938,"passed",110,"drama",7.2,NA,"andrew manson, a young, enthusiastic doctor takes his first job in a welsh mining town, and begins to wonder at the persistent cough many of the miners have. when his attempts to prove its ...                see full summary »","king vidor","robert donat, rosalind russell, ralph richardson, rex harrison",1560,NA
"20",20,"algiers",1938,"unrated",96,"drama, mystery, romance",6.9,NA,"beautiful gaby meets a romantic jewel thief in the mysterious casbah.","john cromwell","charles boyer, hedy lamarr, sigrid gurie, joseph calleia",1897,NA
"21",21,"unashamed: a romance",1938,NA,66,"drama, romance",6.3,NA,"rae lane entices her workaholic boss to come to a nudist camp in the hopes of winning his heart. things go swimmingly, until attractive and pert blond barbara captures his attention.","allen stuart","rae kidd, robert stanley, lucille shearer, emily todd",50,NA
"22",22,"sex madness",1938,NA,57,"drama",2.5,NA,"philanthropist paul lorenz is one of the more public faces in the fight against behavior that spreads the many ""social diseases"", such as syphilis and gonorrhea. an example of such behavior...                see full summary »","dwain esper","vivian mcgill, rose tapley, al rigali, mark daniels",569,NA
"23",23,"the dawn patrol",1938,"not rated",103,"war, drama",7.6,NA,"british flying aces in world war i contend with the harsh realities of war.","edmund goulding","errol flynn, basil rathbone, david niven, donald crisp",2195,NA
"24",24,"rebecca of sunnybrook farm",1938,"approved",81,"comedy, drama, family",7.1,NA,"rebecca's uncle harry leaves her with aunt miranda who forbids her to associate with show people. but neighbor anthony kent is a talent scout who secretly set it up for her to broadcast.","allan dwan","shirley temple, randolph scott, jack haley, gloria stuart",1114,NA
"25",25,"joy of living",1938,"approved",91,"comedy, musical, romance",6.5,NA,"broadway star margaret garrett has spent her whole life working to support her sponging relatives. when she meets carefree dan webster, she learns how to have fun for the first time.","tay garnett","irene dunne, douglas fairbanks jr., alice brady, guy kibbee",579,NA
"26",26,"the cowboy and the lady",1938,"approved",91,"comedy, drama, romance",6.7,NA,"a lonely socialite masquerades as a maid and meets an unpretentious, plain-spoken cowboy who is unaware of her true identity.","h.c. potter, stuart heisler, william wyler","gary cooper, merle oberon, patsy kelly, walter brennan",954,NA
"27",27,"love finds andy hardy",1938,"passed",91,"comedy, romance",6.9,NA,"andy's girlfriend polly is planning to spend christmas at her grandmother's, which puts a kink in his plans to take her to the country club christmas party. he agrees (for a fee) to pretend...                see full summary »","george b. seitz","mickey rooney, judy garland, lewis stone, fay holden",1291,NA
"28",28,"billy the kid returns",1938,"passed",53,"comedy, music, romance",6.1,NA,"after pat garrett kills billy the kid, billy's look-alike roy rogers arrives and is mistaken for him. although a murderer, billy was on the side of the homesteaders against the large ...                see full summary »","joseph kane","roy rogers, smiley burnette, lynne roberts, morgan wallace",157,NA
"29",29,"three comrades",1938,"passed",98,"drama, romance",7.4,NA,"a love story centered around the lives of three young german soldiers in the years following world war i. their close friendship is strengthened by their shared love for the same woman who ...                see full summary »","frank borzage","robert taylor, margaret sullavan, franchot tone, robert young",1378,NA
"30",30,"the young in heart",1938,"approved",90,"comedy, drama",7.3,NA,"thrown out of the riviera, a family of grifters meets a lonely, vulnerable rich old woman and insinuate themselves into her life while they sponge off her.","richard wallace, lewis milestone, gilbert pratt, richard thorpe","janet gaynor, douglas fairbanks jr., roland young, billie burke",950,NA
"31",31,"flash gordon's trip to mars",1938,"approved",299,"action, adventure, sci-fi",7.4,NA,"when a deadly nitron ray strikes earth, flash gordon and his friends travel to mars to battle ming the merciless and his new ally queen azura.","ford beebe, robert f. hill, frederick stephani","buster crabbe, jean rogers, charles middleton, frank shannon",685,NA
"32",32,"block-heads",1938,"approved",57,"comedy, war",7.7,NA,"it's 1938, but stan doesn't know the war is over; he's still patrolling the trenches in france, and shoots down a french aviator. oliver sees his old chum's picture in the paper and goes to...                see full summary »","john g. blystone","stan laurel, oliver hardy, patricia ellis, minna gombell",2644,NA
"33",33,"topper takes a trip",1938,"approved",80,"comedy, fantasy, romance",6.7,NA,"to gain entry to heaven, a ghost attempts to reunite a divorcing couple as a good deed.","norman z. mcleod","constance bennett, roland young, billie burke, alan mowbray",832,NA
"34",34,"a man to remember",1938,"approved",79,"drama, romance",7.1,NA,"doctor john abbott is a single parent who settles in the town of westport, with his son dick, trying to eke out a living for them. he also inherits, by way of his doorstep, an unwanted baby...                see full summary »","garson kanin","anne shirley, edward ellis, lee bowman, william henry",333,NA
"35",35,"bluebeard's eighth wife",1938,"passed",85,"comedy, romance",7.4,NA,"after learning her multi-millionaire fiancé has already been married and divorced seven times, the daughter of a penniless marquis decides to tame him.","ernst lubitsch","claudette colbert, gary cooper, edward everett horton, david niven",2339,NA
"36",36,"of human hearts",1938,"passed",103,"drama, western",6.9,NA,"this is a story about family relationships, set in the time before and during the american civil war. ethan wilkins is a poor and honest man who ministers to the human soul, while his son ...                see full summary »","clarence brown","walter huston, james stewart, beulah bondi, guy kibbee",789,NA
"37",37,"the sisters",1938,"approved",99,"drama",7.1,NA,"three daughters of a small town pharmacist undergo trials and tribulations in their problematic marriages between 1904 and 1908.","anatole litvak","errol flynn, bette davis, anita louise, ian hunter",1384,NA
"38",38,"the shopworn angel",1938,"passed",85,"drama, romance, war",7.1,NA,"shortly after the united states enters world war i in 1917, a broadway actress agrees to let a naive soldier court her in order to impress his friends, but a real romance soon begins.","h.c. potter","margaret sullavan, james stewart, walter pidgeon, hattie mcdaniel",1047,NA
"39",39,"yellow jack",1938,"passed",83,"drama, history, mystery",6.4,NA,"in the fever-stricken areas of cuba a brave band of scientists, doctors and u. s. marines fight a losing battle against the deadly plague of 'yello jack,' until the great heroic risk taken by an irish sergeant brings victory.","george b. seitz","robert montgomery, virginia bruce, lewis stone, andy devine",171,NA
"40",40,"the lone ranger",1938,"approved",264,"western",7.1,NA,"chap. 1, hi yo silver: an outlaw leader planning to take control of texas after the civil war kills colonel jeffries, a man empowered to levy taxes, and assumes his identity. his men then ...                see full summary »","john english, william witney","silver king the horse, chief thundercloud, lynne roberts, stanley andrews",142,NA
"41",41,"the baroness and the butler",1938,"approved",80,"comedy, drama, romance",6.6,NA,"a butler gets elected to the hungarian parliament where he opposes his master's government.","walter lang","william powell, annabella, helen westley, henry stephenson",328,NA
"42",42,"booloo",1938,"approved",61,"action, adventure, thriller",4,NA,"a young-stiff-upper-lipped british officer, robert rogers writes a book about a white tiger and sacrifices of native girls by the sakai tribe in malaya. but the critics ridicule the book. ...                see full summary »","clyde e. elliott","colin tapley, jayne regan, mamo clark, herbert de souza",16,NA
"43",43,"port of shadows",1938,"approved",91,"crime, drama, romance",7.7,NA,"a military deserter finds love and trouble (and a small dog) in a smoky french port city.","marcel carné","jean gabin, michel simon, michèle morgan, pierre brasseur",6718,NA
"44",44,"room service",1938,"approved",78,"comedy",6.8,NA,"a penniless theatrical producer must outwit the hotel efficiency expert trying to evict him from his room, while securing a backer for his new play.","william a. seiter","groucho marx, harpo marx, chico marx, lucille ball",3970,NA
"45",45,"sidewalks of london",1938,"approved",85,"comedy",7.1,NA,"on the sidewalks of the london theater district the buskers (street performers) earn enough coins for a cheap room. charles, who recites dramatic monologues, sees that a young pickpocket, ...                see full summary »","tim whelan","charles laughton, vivien leigh, rex harrison, larry adler",879,NA
"46",46,"the adventures of tom sawyer",1938,"approved",91,"family, adventure",7.3,NA,"tom sawyer and his pal huckleberry finn have great adventures on the mississippi river, pretending to be pirates, attending their own funeral and witnessing a murder.","norman taurog","tommy kelly, ann gillis, may robson, walter brennan",1343,NA
"47",47,"alexander's ragtime band",1938,"approved",106,"drama, musical, romance",7,NA,"this send-up of ragtime song and dance begins in 1915 san francisco when society boy roger grant decides to pursue popular rather than serious music.","henry king","tyrone power, alice faye, don ameche, ethel merman",1515,NA
"48",48,"drums",1938,"not rated",104,"adventure, war",6.5,NA,"set in the india of the british raj. all the indians are portrayed as untrustworthy, plotting to overthrow their british masters. the only 'loyal' indian is prince azim who tries to warn ...                see full summary »","zoltan korda","sabu, raymond massey, roger livesey, valerie hobson",628,NA
"49",49,"swiss miss",1938,"approved",73,"comedy, musical",6.8,NA,"stanley and oliver are mousetrap salesmen hoping to strike it rich in switzerland, but get swindled out of all their money by a cheesemaker. while working off their hotel debt, oliver falls...                see full summary »","john g. blystone, hal roach","stan laurel, oliver hardy, grete natzler, walter woolf king",1434,NA
"50",50,"merrily we live",1938,"passed",95,"comedy, romance",7.4,NA,"dizzy society matron emily kilbourne has a habit of hiring ex-cons and hobos as servants. her latest find is a handsome ""tramp"" who shows up at her doorstep and soon ends up in a ...                see full summary »","norman z. mcleod","constance bennett, brian aherne, alan mowbray, billie burke",1155,NA
"51",51,"child bride",1938,NA,62,"drama",4.7,NA,"schoolteacher in a rural community campaigns to stop the practice of older men marrying young, underage girls.","harry revier","shirley mills, bob bollinger, warner richmond, diana durrell",744,NA
"52",52,"the mad miss manton",1938,"approved",80,"comedy, crime, mystery",6.9,NA,"when the murdered body discovered by beautiful, vivacious socialite melsa manton disappears, police and press label her a prankster until she proves them wrong.","leigh jason","barbara stanwyck, henry fonda, sam levene, frances mercer",1545,NA
"53",53,"test pilot",1938,"passed",119,"drama, romance",6.9,NA,"jim is a test pilot. his wife ann and best friend gunner try their best to keep him sober. but the life of a test pilot is anything but safe.","victor fleming","clark gable, myrna loy, spencer tracy, lionel barrymore",1716,NA
"54",54,"the baker's wife",1938,"not rated",133,"comedy, drama",7.7,NA,"in this little provencal village, a new baker, aimable, settles down. his wife aurelie is beautiful and much younger than he. she departs with a shepherd the night after aimable produces ...                see full summary »","marcel pagnol","raimu, ginette leclerc, fernand charpin, robert vattier",1160,NA
"55",55,"the terror of tiny town",1938,"approved",62,"western",3.5,NA,"an evil gunslinging midget comes to terrorize the good little people of tiny town. the townspeople organize to defeat him, and zany antics ensue","sam newfield","billy curtis, yvonne moray, 'little billy' rhodes, billy platt",1314,NA
"56",56,"a yank at oxford",1938,"passed",102,"drama, romance, sport",6.7,NA,"lee sheridan's ego has always been stoked by his newspaper publisher father, dan sheridan, who is willing to ""hold the presses"" solely to print lee's many sporting accomplishments as they ...                see full summary »","jack conway","robert taylor, vivien leigh, lionel barrymore, maureen o'sullivan",872,NA
"57",57,"the buccaneer",1938,"approved",126,"adventure, history",6.7,NA,"semi-fictional account of pirate jean lafitte's involvement in the war of 1812.","cecil b. demille","fredric march, franciska gaal, akim tamiroff, margot grahame",494,NA
"58",58,"too hot to handle",1938,"passed",107,"adventure, comedy, drama",6.7,NA,"two rival newsreel photographers join forces to find the an aviatrix's missing brother, who has disappeared in the amazon rainforest.","jack conway","clark gable, myrna loy, walter pidgeon, walter connolly",1132,NA
"59",59,"carefree",1938,"passed",83,"comedy, musical, romance",7.2,NA,"a psychiatrist agrees to hypnotize his friend's girlfriend in order to convince her to accept his proposals of marriage, but she ends up falling for the psychiatrist instead.","mark sandrich","fred astaire, ginger rogers, ralph bellamy, luella gear",2674,NA
"60",60,"four daughters",1938,"approved",90,"drama, music, romance",7,NA,"adam lemp, the dean of the briarwood music foundation, has passed on his love of music to his four early adult daughters - thea, emma, kay and ann - who live with him and his sister, the ...                see full summary »","michael curtiz","claude rains, john garfield, jeffrey lynn, frank mchugh",1390,NA
"61",61,"three blind mice",1938,"approved",75,"comedy",6.7,NA,"three sisters take their small inheritance and move from kansas to california in search of rich husbands. to start with pamela poses as a socialite and moira and elizabeth pretend to be her...                see full summary »","william a. seiter","loretta young, joel mccrea, david niven, stuart erwin",179,NA
"62",62,"the adventures of marco polo",1938,"passed",104,"adventure, biography, romance",5.7,NA,"adventurer marco polo travels to china, where he finds the emperor kublai khan, court intrigue, danger, and unexpected love.","archie mayo, john cromwell","gary cooper, sigrid gurie, basil rathbone, george barbier",769,NA
"63",63,"too much johnson",1938,NA,67,"comedy",6.2,NA,"a woman has two lovers. when one man finds out about the other, he acts as a villain and chases after the protagonist.","orson welles","joseph cotten, virginia nicolson, edgar barrier, arlene francis",369,NA
"64",64,"mr. wong, detective",1938,"passed",69,"adventure, crime, drama",6.2,NA,"when a chemical manufacturer is killed after asking detective james wong to help him, wong investigates this and two subsequent murders. he uncovers a international spy ring hoping to steal...                see full summary »","william nigh","boris karloff, grant withers, maxine jennings, evelyn brent",739,NA
"65",65,"if i were king",1938,"approved",101,"adventure, history",7.3,NA,"vagabond poet françois villon rises to high office in 1463 paris.","frank lloyd","ronald colman, basil rathbone, frances dee, ellen drew",607,NA
"66",66,"little miss broadway",1938,"approved",72,"drama, musical",6.6,NA,"an orphan is provisionally adopted by the manager of a hotel populated by show business people. the hotel's owner doesn't like the entertainers and wants the girl returned to the orphanage.","irving cummings","shirley temple, george murphy, jimmy durante, phyllis brooks",640,NA
"67",67,"professor beware",1938,"passed",93,"comedy",7.1,NA,"egyptologist, dean lambert (lloyd), accused of car-theft, skips bail and begins a cross-country trek to join a group in new york headed for egypt. with the police close on his trail he gets...                see full summary »","elliott nugent","harold lloyd, phyllis welch, william frawley, raymond walburn",116,NA
"68",68,"the great waltz",1938,"passed",104,"biography, drama, music",6.7,NA,"in 1845 vienna, johann strauss ii - schani to his friends - would rather write and perform waltzes than anything else, this at a time when a waltz is not considered proper society music. ...                see full summary »","julien duvivier, victor fleming, josef von sternberg","luise rainer, fernand gravey, miliza korjus, hugh herbert",840,NA
"69",69,"a slight case of murder",1938,"approved",85,"comedy, crime",7.2,NA,"former bootlegger remy marco has a slight problem with forclosing bankers, a prospective son-in-law, and four hard-to-explain corpses.","lloyd bacon","edward g. robinson, jane bryan, allen jenkins, ruth donnelly",1430,NA
"70",70,"alf's button afloat",1938,NA,89,"comedy",6.3,NA,"alf discovers that one of the buttons on his uniform is made from the metal of aladdin's lamp. when he cleans it a genie appears.","marcel varnel","bud flanagan, chesney allen, jimmy nervo, teddy knox",72,NA
"71",71,"the rage of paris",1938,"approved",78,"comedy",7.2,NA,"nicole has no job and is several weeks behind with her rent. her solution to her problem is to try and snare a rich husband. enlisting the help of her friend gloria and the maitre'd at a ...                see full summary »","henry koster","danielle darrieux, douglas fairbanks jr., mischa auer, louis hayward",532,NA
"72",72,"having wonderful time",1938,"approved",70,"comedy, romance",6.1,NA,"teddy shaw, a bored new york office girl, goes to a camp in the catskill mountains for rest and finds chick kirkland.","alfred santell","ginger rogers, douglas fairbanks jr., peggy conklin, lucille ball",541,NA
"73",73,"that certain age",1938,NA,95,"comedy, musical",7,NA,"dashing reporter vincent bullit has just returned from covering the spanish civil war. his boss, newspaper magnate fullerton, has more plans to send him off to china. however, first ...                see full summary »","edward ludwig","deanna durbin, melvyn douglas, jackie cooper, irene rich",211,NA
"74",74,"the divorce of lady x",1938,"not rated",91,"comedy, drama, romance",6.8,NA,"divorce lawyer everard logan thinks the woman who spent the night in his hotel room is the erring wife of his new client.","tim whelan","merle oberon, laurence olivier, binnie barnes, ralph richardson",994,NA
"75",75,"sweethearts",1938,"passed",114,"musical",6.6,NA,"a musical comedy duo in their 6th year on broadway receive an offer to perform in hollywood making films. the change of lifestyle is inviting to the sweethearts as the move will take them ...                see full summary »","w.s. van dyke, robert z. leonard","jeanette macdonald, nelson eddy, frank morgan, ray bolger",463,NA
"76",76,"man-proof",1938,"passed",75,"comedy, drama, romance",6,NA,"mimi has tried everything to become the bride to alan, but he chooses elizabeth instead. the ironic part is that mimi's mother writes romance novels and neither one has had any luck with ...                see full summary »","richard thorpe","myrna loy, franchot tone, rosalind russell, walter pidgeon",336,NA
"77",77,"service de luxe",1938,NA,85,"comedy",6.9,NA,"the manager of a service agency for the wealthy clashes with - and falls for - an inventor who is seeking funding for a new kind of tractor.","rowland v. lee","constance bennett, vincent price, charles ruggles, helen broderick",99,NA
