"","rank","title","release_year","rating","runtime","genres","movie_rating","metascore","description","directors","actors","votes","gross_in_millions"
"83",83,"volunteers",1985,"r",107,"comedy",5.5,NA,"lawrence is a rich kid with a bad accent and a large debt. after his father refuses to help him out, lawrence escapes his angry debtors by jumping on a peace corp flight to southeast asia, ...                see full summary »","nicholas meyer","tom hanks, john candy, rita wilson, tim thomerson",7162,NA
"84",84,"a chorus line",1985,"pg-13",113,"drama, music, musical",6.1,"46","hopefuls try out before a demanding for a part in a new musical.","richard attenborough","michael douglas, terrence mann, michael blevins, yamil borges",7963,NA
"85",85,"howling ii: ... your sister is a werewolf",1985,"r",91,"horror, thriller",3.4,NA,"a young man whose sister was murdered by werewolves helps an investigator track down a gang of the monsters through the united states and europe.","philippe mora","christopher lee, annie mcenroe, reb brown, marsha a. hunt",5063,NA
"86",86,"prizzi's honor",1985,"r",130,"comedy, crime, drama",6.8,NA,"a professional hitman and hitwoman fall in love.","john huston","jack nicholson, kathleen turner, robert loggia, john randolph",19744,NA
"87",87,"tuff turf",1985,"r",112,"action, drama",6.2,NA,"the new kid in school must battle a gang of street toughs after stealing the gang leader's girl.","fritz kiersch","james spader, kim richards, paul mones, matt clark",3074,NA
"88",88,"d.a.r.y.l.",1985,"pg",99,"family, sci-fi",6.2,NA,"a seemingly normal young boy turns out to be a top secret military-created robot with superhuman abilities.","simon wincer","mary beth hurt, michael mckean, kathryn walker, colleen camp",10209,NA
"89",89,"malibu express",1985,"r",105,"comedy, crime, mystery",4.3,NA,"a smooth-talking private eye is assigned the task of investigating who is behind the hi-tech computer technology leaks to the russians.","andy sidaris","darby hinton, sybil danning, art metrano, shelley taylor morgan",1191,NA
"90",90,"the purple rose of cairo",1985,"pg",82,"comedy, fantasy, romance",7.7,"75","in new jersey in 1935, a movie character walks off the screen and into the real world.","woody allen","mia farrow, jeff daniels, danny aiello, irving metzman",39780,NA
"91",91,"summer rental",1985,"pg",87,"comedy",6.2,"38","an overworked air-traffic controller takes his family on a beach vacation but is soon beset by series of mishaps.","carl reiner","john candy, richard crenna, rip torn, karen austin",11159,NA
"92",92,"murphy's romance",1985,"pg-13",107,"comedy, drama, romance",7,NA,"emma is a divorced woman with a teen-aged son who moves into a small town and tries to make a go of a horse ranch. murphy is the widowed town druggist who steers business her way. things ...                see full summary »","martin ritt","sally field, james garner, brian kerwin, corey haim",4560,NA
"93",93,"white nights",1985,"pg-13",136,"drama",6.6,"46","an expatriate russian dancer is on a plane forced to land on soviet territory. he is taken to an apartment in which a black american who has married a russian woman lives with her. he is to...                see full summary »","taylor hackford","mikhail baryshnikov, gregory hines, jerzy skolimowski, helen mirren",5681,NA
"94",94,"king solomon's mines",1985,"pg-13",100,"action, adventure, comedy",5.1,NA,"fortune hunter allan quatermain teams up with a resourceful woman to help her find her missing father lost in the wilds of 1900s africa while being pursued by hostile tribes and a rival german explorer.","j. lee thompson","richard chamberlain, sharon stone, herbert lom, john rhys-davies",10582,NA
"95",95,"tampopo",1985,"not rated",114,"comedy",7.9,NA,"a truck driver stops at a small family-run noodle shop and decides to help its fledgling business. the story is intertwined with various vignettes about the relationship of love and food.","jûzô itami","ken watanabe, tsutomu yamazaki, nobuko miyamoto, kôji yakusho",11071,NA
"96",96,"the emerald forest",1985,"r",114,"action, adventure, drama",6.9,NA,"after the son of engineer bill markham is abducted by an aboriginal tribe on the edge of the rain forest, the engineer spends the next 10 years searching for him.","john boorman","powers boothe, meg foster, yara vaneau, william rodriguez",7968,NA
"97",97,"the quiet earth",1985,"r",91,"drama, mystery, sci-fi",6.8,NA,"a man named zac hobson awakens to find himself alone in the world. in a desperate attempt to search for others, he finds only two who have their own agenda.","geoff murphy","bruno lawrence, alison routledge, pete smith, anzac wallace",21635,NA
"98",98,"my beautiful laundrette",1985,"r",97,"comedy, drama, romance",6.9,NA,"an ambitious pakistani briton and his white boyfriend strive for success and hope when they open a glamorous laundromat.","stephen frears","saeed jaffrey, roshan seth, daniel day-lewis, richard graham",11534,NA
"99",99,"year of the dragon",1985,"r",134,"action, crime, drama",6.9,NA,"a police detective cracks down on organized crime in chinatown after the murders of triad and mafia leaders.","michael cimino","mickey rourke, john lone, ariane, leonard termo",11521,NA
"100",100,"remo williams: the adventure begins",1985,"pg-13",121,"action, adventure, comedy",6.4,NA,"an officially ""dead"" cop is trained to become an extraordinarily unique assassin in service of the us president.","guy hamilton","fred ward, joel grey, wilford brimley, j.a. preston",9342,NA
