"","rank","title","release_year","rating","runtime","genres","movie_rating","metascore","description","directors","actors","votes","gross_in_millions"
"86",86,"romeo is bleeding",1993,"r",100,"action, crime, drama",6.6,NA,"a womanizing, crooked cop on the payroll of the mafia is confronted with the reality of his double life after he is asked to kill a beautiful and ruthless russian gangster.","peter medak","gary oldman, lena olin, wallace wood, juliette lewis",11457,NA
"87",87,"swing kids",1993,"pg-13",112,"drama, music",6.8,"39","a close-knit group of young kids in nazi germany listen to banned swing music from the us. soon dancing and fun lead to more difficult choices as the nazis begin tightening the grip on ...                see full summary »","thomas carter","robert sean leonard, christian bale, frank whaley, barbara hershey",13949,NA
"88",88,"the dark half",1993,"r",122,"horror, mystery, thriller",5.9,"53","a writer's fictional alter ego wants to take over his life...at any price.","george a. romero","timothy hutton, amy madigan, michael rooker, julie harris",13056,NA
"89",89,"the thing called love",1993,"pg-13",116,"comedy, drama, music",6.3,NA,"a group of newcomers to the country music business seek love and stardom.","peter bogdanovich","river phoenix, samantha mathis, dermot mulroney, sandra bullock",6111,NA
"90",90,"dave",1993,"pg-13",110,"comedy, romance",6.8,NA,"to avoid a potentially explosive scandal when the u.s. president goes into a coma, an affable temp agency owner with an uncanny resemblance is put in his place.","ivan reitman","kevin kline, sigourney weaver, frank langella, kevin dunn",42964,NA
"91",91,"return of the living dead iii",1993,"r",97,"horror",5.9,NA,"having recently witnessed the horrific results of a top secret project to bring the dead back to life, a distraught youth performs the operation on his girlfriend after she's killed in a motorcycle accident.","brian yuzna","kent mccord, james t. callahan, sarah douglas, melinda clarke",11220,NA
"92",92,"beethoven's 2nd",1993,"pg",89,"comedy, family, romance",4.8,NA,"beethoven, the st. bernard dog, becomes a father, but his girlfriend missy is dognapped, and his puppies are in danger of the same fate.","rod daniel","charles grodin, bonnie hunt, nicholle tom, christopher castile",21132,NA
"93",93,"m. butterfly",1993,"r",101,"drama, romance",6.8,"43","in 1960s china, french diplomat rene gallimard falls in love with an opera singer, song liling - but song is not at all who gallimard thinks.","david cronenberg","jeremy irons, john lone, barbara sukowa, ian richardson",7299,NA
"94",94,"nowhere to run",1993,"r",94,"action, crime, drama",5.6,NA,"escaped convict sam gillen single handedly takes on ruthless developers determined to evict clydie - a widow with two young children. nobody knows who sam is.","robert harmon","jean-claude van damme, rosanna arquette, kieran culkin, ted levine",18614,NA
"95",95,"freaked",1993,"pg-13",80,"comedy, sci-fi",6.3,NA,"a vain actor, his best friend, and an activist end up at a mutant freak farm run by a weirdo scientist.","tom stern, alex winter","brooke shields, william sadler, eduardo ricard, henry carbo",4941,NA
"96",96,"sniper",1993,"r",98,"action, thriller, war",6.1,NA,"a us marine sniper is partnered with a swat member to take out rebel leaders in the jungles of panama.","luis llosa","tom berenger, billy zane, j.t. walsh, aden young",20431,NA
"97",97,"look who's talking now",1993,"pg-13",96,"comedy, family, romance",4.2,NA,"in this, the third film, it's the pets who do the talking. the ubriacco's find themselves the owners of two dogs, rocks, a street wise cross breed, and daphne, a spoiled pedigree poodle. ...                see full summary »","tom ropelewski","john travolta, kirstie alley, david gallagher, tabitha lupien",23864,NA
"98",98,"shadowlands",1993,"pg",131,"biography, drama, romance",7.4,NA,"c.s. lewis, a world-renowned christian theologian, writer, and professor, leads a passionless life until he meets a spirited poet from the u.s.","richard attenborough","anthony hopkins, debra winger, julian fellowes, roddy maude-roxby",14309,NA
"99",99,"teenage mutant ninja turtles iii",1993,"pg",96,"action, adventure, comedy",4.8,NA,"the turtles find themselves transported back in time to ancient japan.","stuart gillard","elias koteas, paige turco, stuart wilson, sab shimono",26766,NA
"100",100,"little buddha",1993,"pg",123,"drama",6,NA,"lama norbu comes to seattle in search of the reincarnation of his dead teacher, lama dorje. his search leads him to young jesse conrad, raju, a waif from kathmandu, and an upper class ...                see full summary »","bernardo bertolucci","keanu reeves, bridget fonda, ruocheng ying, chris isaak",13276,NA
