"","rank","title","release_year","rating","runtime","genres","movie_rating","metascore","description","directors","actors","votes","gross_in_millions"
"82",82,"love letters",1945,"approved",101,"drama, mystery, romance",7.2,NA,"allen quinton writes a fellow soldier's love letters; tragedy results. later, allen meets a beautiful amnesiac who fears postmen...","william dieterle","jennifer jones, joseph cotten, ann richards, cecil kellaway",1233,NA
"83",83,"the corn is green",1945,"not rated",115,"drama",7.7,NA,"a schoolteacher becomes the mentor of a talented young miner and seeks to get him into a university.","irving rapper","bette davis, john dall, nigel bruce, rhys williams",1956,NA
"84",84,"pride of the marines",1945,"approved",120,"biography, drama, romance",7.4,NA,"marine hero al schmid is blinded in battle and returns home to be rehabilitated. he readjusts to his civilian life with the help of his soon to be wife.","delmer daves","john garfield, eleanor parker, dane clark, john ridgely",975,NA
"85",85,"the naughty nineties",1945,"approved",76,"comedy, crime, romance",7.5,NA,"when their captain is swindled out of his riverboat by a trio of gamblers, stage show star abbott and his bumbling sidekick costello must put things right.","jean yarbrough","bud abbott, lou costello, alan curtis, rita johnson",1522,NA
"86",86,"a thousand and one nights",1945,"approved",93,"adventure, comedy, fantasy",6.1,NA,"tongue-in-cheek fantasy film set in baghdad and loosely based on the one thousand and one nights medieval story.","alfred e. green","evelyn keyes, phil silvers, adele jergens, cornel wilde",393,NA
"87",87,"hotel berlin",1945,NA,98,"drama, war",6.7,NA,"near the end of ww ii, a member of the german underground (martin richter) escapes from the gestapo and takes shelter at hotel berlin, where he meets lisa dorn, a sleek actress involved ...                see full summary »","peter godfrey","faye emerson, helmut dantine, raymond massey, andrea king",496,NA
"88",88,"zombies on broadway",1945,"approved",69,"comedy, fantasy, horror",5.3,NA,"two bumbling press agents must search for a zombie to fulfill a commitment to their ex-gangster boss's new nightclub or face the consequences.","gordon douglas","wally brown, alan carney, bela lugosi, anne jeffreys",602,NA
"89",89,"cornered",1945,"approved",102,"drama, film-noir, thriller",6.8,NA,"canadian flyer laurence gerard finds that his wife has been murdered by a french collaborator. his quest for justice leads him to switzerland and argentina.","edward dmytryk","dick powell, walter slezak, micheline cheirel, nina vale",1441,NA
"90",90,"a royal scandal",1945,"unrated",94,"comedy, drama, history",6.9,NA,"in 18th century russia,the naive and idealistic lieutenant chernov meets empress catherine the great who becomes infatuated with him and appoints him chief of the imperial guard.","otto preminger, ernst lubitsch","tallulah bankhead, charles coburn, anne baxter, william eythe",688,NA
"91",91,"murder, he says",1945,NA,91,"comedy",7.7,NA,"a pollster stumbles on a family of murderous hillbillies, and joins in their search for hidden treasure.","george marshall","fred macmurray, helen walker, marjorie main, jean heather",1439,NA
"92",92,"god is my co-pilot",1945,"approved",90,"action, adventure, biography",6.6,NA,"robert l. scott has dreamed his whole life of being a fighter pilot, but when war comes he finds himself flying transport planes over the hump into china. in china, he persuades general ...                see full summary »","robert florey","dennis morgan, raymond massey, dane clark, alan hale",472,NA
"93",93,"the horn blows at midnight",1945,"approved",78,"comedy, fantasy, music",6.8,NA,"falling asleep during the paradise coffee (""the coffee that makes you sleep"") program, the band's third trumpeter dreams he's athanael, an angel deputized to blow the last trumpet at ...                see full summary »","raoul walsh","jack benny, alexis smith, dolores moran, allyn joslyn",989,NA
"94",94,"jungle queen",1945,"approved",219,"action, adventure, drama",5.8,NA,"a young girl journeys to africa to find her father, an explorer who vanished in the jungle.","lewis d. collins, ray taylor","edward norris, eddie quillan, douglass dumbrille, lois collier",42,NA
"95",95,"the strange affair of uncle harry",1945,"approved",80,"drama, film-noir",6.9,NA,"bachelor harry quincey, head designer in a small-town cloth factory, lives with his selfish sisters, glamorous hypochondriac lettie and querulous widow hester. his developing relationship ...                see full summary »","robert siodmak","george sanders, ella raines, geraldine fitzgerald, sara allgood",924,NA
"96",96,"you came along",1945,"unrated",103,"drama, romance",7.1,NA,"war hero flier bob collins goes on a war bond selling tour with two buddies, and substitute ""chaperone"" ivy hotchkiss. bob's a cheerful lothario with several girls in every town on the tour...                see full summary »","john farrow","robert cummings, lizabeth scott, don defore, charles drake",134,NA
"97",97,"pillow to post",1945,"approved",92,"comedy",6.7,NA,"with a war on and most men being drafted, howard oil supply company has no salesmen left. so daughter jean hits the road and does not make one sale. she finally gets one tentative sale with...                see full summary »","vincent sherman","ida lupino, sydney greenstreet, william prince, stuart erwin",317,NA
"98",98,"she wouldn't say yes",1945,NA,87,"comedy, romance",6.3,NA,"susan lane is a gifted psychiatrist, grounded in self-control. before returning by train to her practice in chicago, she spends time back east with war veterans, building their self-esteem,...                see full summary »","alexander hall","rosalind russell, lee bowman, adele jergens, charles winninger",329,NA
"99",99,"boston blackie booked on suspicion",1945,NA,66,"crime, drama, mystery",6.5,NA,"blackie is implicated in a murder when he accidently sells a phony charles dickens first edition at an auction.","arthur dreifuss","chester morris, lynn merrick, richard lane, frank sully",260,NA
"100",100,"fog island",1945,"unrated",72,"drama, horror, mystery",5.2,NA,"an inventor recently released from prison invites a group of former business associates to a holiday in his island home, intending to exact revenge on them.","terry o. morse","george zucco, lionel atwill, jerome cowan, sharon douglas",495,NA
