"","rank","title","release_year","rating","runtime","genres","movie_rating","metascore","description","directors","actors","votes","gross_in_millions"
"86",86,"frühreifen-report",1973,"x",87,"comedy",5.3,NA,"a series of morality stories told by a social welfare case worker, centering around the budding sexuality of young teens, similar in vein to the schoolgirl report series:(1) 13-year-old ...                see full synopsis »","ernst hofbauer","harald baerow, hans billian, ulrike butz, elke deuringer",182,NA
"87",87,"black mama white mama",1973,"r",87,"crime, drama, thriller",5.6,NA,"when two troublemaking female prisoners (one a revolutionary, the other a former harem-girl) can't seem to get along, they are chained together and extradited for safekeeping. the women, ...                see full summary »","eddie romero","pam grier, margaret markov, sid haig, lynn borden",2072,NA
"88",88,"wonder women",1973,"pg",82,"action, horror, sci-fi",4.9,NA,"an insurance investigator battles dr. tsu and her sexy all-girl army.","robert vincent o'neill","nancy kwan, ross hagen, maria de aragon, roberta collins",301,NA
"89",89,"the last of sheila",1973,"pg",120,"crime, drama, mystery",7.4,NA,"a year after sheila is killed in a hit-and-run, her multi-millionaire husband invites a group of friends to spend a week on his yacht playing a scavenger hunt-style mystery game. the game turns out to be all too real and all too deadly.","herbert ross","richard benjamin, james coburn, james mason, dyan cannon",4012,NA
"90",90,"electra glide in blue",1973,"pg",114,"crime, drama, mystery",7.2,NA,"bored with his highway traffic duties, arizona motorcycle patrolman john wintergreen is assigned to homicide where his polite investigative style irks his macho boss.","james william guercio","robert blake, billy green bush, mitchell ryan, jeannine riley",3950,NA
"91",91,"lost horizon",1973,"g",150,"fantasy, musical, adventure",5.2,NA,"this retelling of the classic tale of james hilton's utopian lost world plays out uneasily amid musical production numbers and bacharach pop music. while escaping war-torn china, a group of...                see full summary »","charles jarrott","peter finch, liv ullmann, sally kellerman, george kennedy",1692,NA
"92",92,"la rose de fer",1973,"tv-ma",86,"fantasy, horror",6.3,NA,"a young couple out for a walk decide to take a stroll through a large cemetery. as darkness begins to fall they realize they can't find their way out, and soon their fears begin to overtake them.","jean rollin","françoise pascal, hugues quester, natalie perrey, mireille dargent",1249,NA
"93",93,"existence",1973,NA,105,"drama",6.3,NA,"""the 14"" or ""existance"" has a mother of 14 children living in poor working class england falling sick and the children try to carry on as a family. convincing acting from young actors raises this gritty tale above the horizon.","david hemmings","jack wild, june brown, liz edmiston, john bailey",121,NA
"94",94,"idaho transfer",1973,"pg",86,"sci-fi",5.4,NA,"during a time of waning global resources, a crew of young researchers travel into the future to escape an apocalypse before the shutdown of their time transfer project. they find that some ...                see full summary »","peter fonda","kelly bohanon, kevin hearst, caroline hildebrand, keith carradine",646,NA
"95",95,"the death wheelers",1973,"pg",85,"adventure, horror",5.8,NA,"a gang of young people call themselves the living dead. they terrorize the population from their small town. after an agreement with the devil, if they kill themselves firmly believing in ...                see full summary »","don sharp","george sanders, beryl reid, nicky henson, mary larkin",1860,NA
"96",96,"save the tiger",1973,"r",100,"drama",6.9,NA,"a disillusioned aging decent man and once proud wwii veteran is dealing with midlife crisis as well as a tough moral dilemma. if he wants his small near-bankrupt clothing company to survive, he has two days to let go of his shaken morals.","john g. avildsen","jack lemmon, jack gilford, laurie heineman, norman burton",3819,NA
"97",97,"the train robbers",1973,"pg",92,"comedy, romance, western",6.4,NA,"a gunhand named lane is hired by a widow, mrs. lowe, to find gold stolen by her husband so that she may return it and start fresh.","burt kennedy","john wayne, ann-margret, rod taylor, ben johnson",4197,NA
"98",98,"pigs",1973,"r",80,"horror",4.3,NA,"lynn hart is a disturbed young woman who escapes from a mental hospital where she was committed for killing her abusive father who raped her. stealing a nurse's uniform and car, lynn ends ...                see full summary »","marc lawrence","toni lawrence, jesse vint, catherine ross, paul hickey",717,NA
"99",99,"the stone killer",1973,"r",95,"action, crime, drama",6.2,NA,"a top new york detective is sent to los angeles where he must solve a case involving an old sicilian mafia family feud.","michael winner","charles bronson, martin balsam, jack colvin, paul koslo",2038,NA
"100",100,"thriller: a cruel picture",1973,NA,104,"action, thriller",6.5,NA,"a young woman, muted after a sexual assault as a child, is trained to seek violent revenge on those who have wronged her after being kidnapped and forced to work as a prostitute.","bo arne vibenius","christina lindberg, heinz hopf, despina tomazani, per-axel arosenius",5739,NA
