"","rank","title","release_year","rating","runtime","genres","movie_rating","metascore","description","directors","actors","votes","gross_in_millions"
"1",1,"house of wax",1953,"approved",88,"horror",7.1,NA,"an associate burns down a wax museum with the owner inside, but he survives only to become vengeful and murderous.","andré de toth","vincent price, frank lovejoy, phyllis kirk, carolyn jones",12986,NA
"2",2,"peter pan",1953,"approved",77,"animation, adventure, family",7.3,NA,"wendy and her brothers are whisked away to the magical world of neverland with the hero of their stories, peter pan.","clyde geronimi, wilfred jackson, hamilton luske, jack kinney","bobby driscoll, kathryn beaumont, hans conried, bill thompson",99177,NA
"3",3,"roman holiday",1953,"passed",118,"comedy, romance",8.1,"76","a bored and sheltered princess escapes her guardians and falls in love with an american newsman in rome.","william wyler","gregory peck, audrey hepburn, eddie albert, hartley power",109680,NA
"4",4,"shane",1953,"approved",118,"drama, western",7.7,NA,"a weary gunfighter attempts to settle down with a homestead family, but a smoldering settler/rancher conflict forces him to act.","george stevens","alan ladd, jean arthur, van heflin, brandon de wilde",30644,NA
"5",5,"from here to eternity",1953,"not rated",118,"drama, romance, war",7.7,NA,"in hawaii in 1941, a private is cruelly punished for not boxing on his unit's team, while his captain's wife and second-in-command are falling in love.","fred zinnemann","burt lancaster, montgomery clift, deborah kerr, donna reed",36503,NA
"6",6,"the war of the worlds",1953,"approved",85,"action, sci-fi, thriller",7.1,NA,"a small town in california is attacked by martians, beginning a worldwide invasion.","byron haskin","gene barry, ann robinson, les tremayne, robert cornthwaite",27352,NA
"7",7,"the wages of fear",1953,"not rated",131,"adventure, drama, thriller",8.2,NA,"in a decrepit south american village, four men are hired to transport an urgent nitroglycerine shipment without the equipment that would make it safe.","henri-georges clouzot","yves montand, charles vanel, peter van eyck, folco lulli",39942,NA
"8",8,"tokyo story",1953,"not rated",136,"drama",8.2,NA,"an old couple visit their children and grandchildren in the city; but the children have little time for them.","yasujirô ozu","chishû ryû, chieko higashiyama, sô yamamura, setsuko hara",33007,NA
"9",9,"gentlemen prefer blondes",1953,"not rated",91,"comedy, musical, romance",7.2,NA,"showgirls lorelei lee and dorothy shaw travel to paris, pursued by a private detective hired by the suspicious father of lorelei's fiancé, as well as a rich, enamored old man and many other doting admirers.","howard hawks","jane russell, marilyn monroe, charles coburn, elliott reid",25351,NA
"10",10,"ugetsu",1953,"approved",96,"drama, fantasy, war",8.2,NA,"a tale of ambition, family, love, and war set in the midst of the japanese civil wars of the sixteenth century.","kenji mizoguchi","masayuki mori, machiko kyô, kinuyo tanaka, mitsuko mito",16078,NA
"11",11,"hondo",1953,"pg",83,"drama, romance, war",7.1,NA,"army despatch rider hondo lane discovers a woman and young son living in the midst of warring apaches and becomes their protector.","john farrow","john wayne, geraldine page, ward bond, michael pate",7423,NA
"12",12,"how to marry a millionaire",1953,"approved",95,"comedy, drama, romance",7,NA,"three women set out to find eligible millionaires to marry, but find true love in the process.","jean negulesco","marilyn monroe, betty grable, lauren bacall, david wayne",17012,NA
"13",13,"stalag 17",1953,"not rated",120,"drama, war",8,NA,"when two escaping american world war ii prisoners are killed, the german p.o.w. camp barracks black marketeer, j.j. sefton, is suspected of being an informer.","billy wilder","william holden, don taylor, otto preminger, robert strauss",45387,NA
"14",14,"the wild one",1953,"approved",79,"drama",6.9,NA,"two rival motorcycle gangs terrorize a small town after one of their leaders is thrown in jail.","laslo benedek","marlon brando, mary murphy, robert keith, lee marvin",12301,NA
"15",15,"calamity jane",1953,"approved",101,"comedy, musical, romance",7.3,NA,"the story of calamity jane, her saloon, and her romance with wild bill hickok.","david butler","doris day, howard keel, allyn ann mclerie, philip carey",6781,NA
"16",16,"julius caesar",1953,"not rated",120,"biography, drama, history",7.4,NA,"the growing ambition of julius caesar is a source of major concern to his close friend brutus. cassius persuades him to participate in his plot to assassinate caesar but they have both sorely underestimated mark antony.","joseph l. mankiewicz","louis calhern, marlon brando, james mason, john gielgud",8579,NA
"17",17,"summer with monika",1953,"r",96,"drama, romance",7.6,NA,"a pair of teenagers meet one summer day, start a reckless affair and abandon their families to be with one another.","ingmar bergman","harriet andersson, lars ekborg, dagmar ebbesen, åke fridell",8786,NA
"18",18,"the big heat",1953,"not rated",90,"crime, film-noir, thriller",8,NA,"tough cop dave bannion takes on a politically powerful crime syndicate.","fritz lang","glenn ford, gloria grahame, jocelyn brando, alexander scourby",18323,NA
"19",19,"fear and desire",1953,"not rated",62,"drama, thriller, war",5.6,NA,"four soldiers trapped behind enemy lines must confront their fears and desires.","stanley kubrick","frank silvera, kenneth harp, paul mazursky, stephen coit",6292,NA
"20",20,"the joe louis story",1953,"unrated",88,"biography, drama, film-noir",6.2,NA,"the life and career of heavyweight champion joe louis, who held the title for 12 years--longer than any other boxer in history--and who had to not only battle opponents inside the ring and racism outside it.","robert gordon","coley wallace, paul stewart, hilda simms, james edwards",248,NA
"21",21,"it came from outer space",1953,"approved",81,"horror, sci-fi",6.6,NA,"a spaceship from another world crashes in the arizona desert and only an amateur stargazer and a schoolteacher suspect alien influence when the local townsfolk begin to act strangely.","jack arnold","richard carlson, barbara rush, charles drake, joe sawyer",6651,NA
"22",22,"titanic",1953,"not rated",98,"drama, history, romance",7.2,NA,"an unhappily married couple struggle to deal with their problems while on board the ill-fated ship.","jean negulesco","clifton webb, barbara stanwyck, robert wagner, audrey dalton",5184,NA
"23",23,"glen or glenda",1953,"pg",65,"drama",4.2,NA,"a psychiatrist tells two stories: one of a transvestite (glen or glenda), the other of a pseudohermaphrodite (alan or anne).","edward d. wood jr.","edward d. wood jr., bela lugosi, lyle talbot, timothy farrell",7035,NA
"24",24,"the robe",1953,"unrated",135,"drama, history",6.8,NA,"in the roman province of judea during the 1st century, roman tribune marcellus gallio is ordered to crucify jesus of nazareth but is tormented by his guilty conscience afterwards.","henry koster","richard burton, jean simmons, victor mature, michael rennie",7224,NA
"25",25,"kiss me kate",1953,"approved",109,"comedy, musical, romance",7.2,NA,"an ex-husband and wife team star in a musical version of 'the taming of the shrew'; off-stage, the production is troublesome with ex-lovers' quarrels and a gangster looking for some money owed to them.","george sidney","kathryn grayson, howard keel, ann miller, keenan wynn",4663,NA
"26",26,"the 5,000 fingers of dr. t.",1953,"approved",89,"family, fantasy, music",6.9,NA,"the bane of adolescent bart collins' existence is the piano lessons he is forced to take under the tutelage of dr. terwilliker, the only person he admits he detests because of his ...                see full summary »","roy rowland","mary healy, hans conried, tommy rettig, peter lind hayes",3098,NA
"27",27,"invaders from mars",1953,"approved",78,"sci-fi",6.5,NA,"a young boy learns that space aliens are taking over the minds of earthlings.","william cameron menzies","helena carter, arthur franz, jimmy hunt, leif erickson",5811,NA
"28",28,"man on a tightrope",1953,"approved",105,"drama, film-noir, thriller",7.1,NA,"czech circus owner-clown and his entire troupe employ a daring stratagem in order to escape en masse from behind the iron curtain.","elia kazan","fredric march, terry moore, gloria grahame, cameron mitchell",782,NA
"29",29,"mogambo",1953,"approved",116,"adventure, drama, romance",6.7,NA,"on a kenyan safari, white hunter victor marswell has a love triangle with seductive american socialite eloise kelly and anthropologist donald nordley's cheating wife linda.","john ford","clark gable, grace kelly, ava gardner, donald sinden",6268,NA
"30",30,"i confess",1953,"not rated",95,"crime, drama, thriller",7.3,NA,"a priest who comes under suspicion for murder cannot clear his name without breaking the seal of the confessional.","alfred hitchcock","montgomery clift, anne baxter, karl malden, brian aherne",15845,NA
"31",31,"split second",1953,"not rated",85,"crime, drama, film-noir",6.9,NA,"two escaped killers take hostages and hide in a nevada mining ghost town without knowing that an atom bomb is scheduled to be tested there the next morning.","dick powell","stephen mcnally, alexis smith, jan sterling, keith andes",1079,NA
"32",32,"beat the devil",1953,"approved",89,"action, adventure, comedy",6.6,NA,"on their way to africa are a group of rogues who hope to get rich there, and a seemingly innocent british couple. they meet and things happen...","john huston","humphrey bogart, jennifer jones, gina lollobrigida, robert morley",6708,NA
"33",33,"martin luther",1953,"approved",105,"biography, drama, history",7.1,NA,"biopic of german priest martin luther covering his life between 1505-1530 a.d. and the birth of the protestant reformation movement.","irving pichel","niall macginnis, john ruddock, pierre lefevre, guy verney",341,NA
"34",34,"the naked spur",1953,"passed",91,"thriller, western",7.4,NA,"a bounty hunter trying to bring a murderer to justice is forced to accept the help of two less-than-trustworthy strangers.","anthony mann","james stewart, janet leigh, robert ryan, ralph meeker",8327,NA
"35",35,"monsieur hulot's holiday",1953,"not rated",83,"comedy",7.6,NA,"monsieur hulot comes to a beachside hotel for a vacation, where he accidentally (but good-naturedly) causes havoc.","jacques tati","jacques tati, nathalie pascaud, micheline rolla, valentine camax",13670,NA
"36",36,"niagara",1953,"approved",92,"film-noir, thriller",7.1,NA,"as two couples are visiting niagara falls, tensions between one wife and her husband reach the level of murder.","henry hathaway","marilyn monroe, joseph cotten, jean peters, max showalter",12094,NA
"37",37,"the beast from 20,000 fathoms",1953,"approved",80,"adventure, horror, sci-fi",6.7,NA,"a ferocious dinosaur awakened by an arctic atomic test terrorizes the north atlantic and, ultimately, new york city.","eugène lourié","paul hubschmid, paula raymond, cecil kellaway, kenneth tobey",5397,NA
"38",38,"dangerous crossing",1953,"approved",75,"drama, film-noir, mystery",7,NA,"when a beautiful bride boards an ocean liner with her new husband, he goes into hiding, and she becomes the target of a murder conspiracy.","joseph m. newman","jeanne crain, michael rennie, max showalter, carl betz",1356,NA
"39",39,"the earrings of madame de...",1953,"not rated",105,"drama, romance",8,NA,"the diamond earrings of a french aristocrat, a wedding gift from her husband, cause a series of conflicts as they change hands repeatedly.","max ophüls","charles boyer, danielle darrieux, vittorio de sica, jean debucourt",7004,NA
"40",40,"the hitch-hiker",1953,"approved",71,"crime, film-noir, thriller",7,NA,"two fishermen pick up a psychotic escaped convict who tells them that he intends to murder them when the ride is over.","ida lupino","edmond o'brien, frank lovejoy, william talman, josé torvay",4804,NA
"41",41,"i vitelloni",1953,"not rated",104,"comedy, drama",8,"87","a character study of five young men at crucial turning points in their lives in a small town in italy.","federico fellini","alberto sordi, franco fabrizi, franco interlenghi, leopoldo trieste",11581,NA
"42",42,"the band wagon",1953,"passed",112,"comedy, musical, romance",7.6,NA,"a pretentiously artistic is hired for a new broadway musical and changes it beyond recognition.","vincente minnelli","fred astaire, cyd charisse, oscar levant, nanette fabray",8162,NA
"43",43,"pickup on south street",1953,"approved",80,"crime, film-noir, thriller",7.8,NA,"a pickpocket unwittingly lifts a message destined for enemy agents and becomes a target for a communist spy ring.","samuel fuller","richard widmark, jean peters, thelma ritter, murvyn vye",10058,NA
"44",44,"scared stiff",1953,"unrated",108,"comedy, horror, musical",6.6,NA,"fleeing a murder charge, a busboy and a nightclub singer wind up on a spooky caribbean island inherited by an heiress.","george marshall","dean martin, jerry lewis, lizabeth scott, carmen miranda",1368,NA
"45",45,"angel face",1953,"not rated",91,"crime, drama, film-noir",7.3,NA,"ambulance driver frank jessup is ensnared in the schemes of the sensuous but dangerous diane tremayne.","otto preminger","robert mitchum, jean simmons, mona freeman, herbert marshall",5512,NA
"46",46,"give a girl a break",1953,"approved",82,"comedy, musical, romance",6.4,NA,"the star of an upcoming broadway production, janet hallson, walks out during rehersals. the producers of the show, ted sturgis, leo belney and bob dowdy begin to search a replacement. after...                see full summary »","stanley donen","marge champion, gower champion, debbie reynolds, dolly sharp",453,NA
"47",47,"the blue parrot",1953,NA,69,"crime, drama",5.3,NA,"a london soho nightclub is the focus for an undercover investigation into the murder of a small-time crook.","john harlow","dermot walsh, jacqueline hill, ballard berkeley, richard pearson",78,NA
"48",48,"the cruel sea",1953,"approved",126,"drama, war",7.7,NA,"the world war ii adventures of a british convoy escort ship and its officers.","charles frend","jack hawkins, donald sinden, john stratton, denholm elliott",3288,NA
"49",49,"the desert rats",1953,"approved",88,"action, adventure, drama",6.8,NA,"richard burton plays a scottish army officer put in charge of a disparate band of anzac troops on the perimeter of tobruk with the german army doing their best to dislodge them.","robert wise","richard burton, james mason, robert newton, robert douglas",3938,NA
"50",50,"treasure of the golden condor",1953,"approved",93,"adventure",6.4,NA,"jean-paul rebels against his bondage to his uncle, the marquis de st. malo, and journeys to the far-off mayan hills of guatemala seeking a hidden treasure. he is the rightful heir to his ...                see full summary »","delmer daves","cornel wilde, constance smith, finlay currie, walter hampden",270,NA
"51",51,"abbott and costello meet dr. jekyll and mr. hyde",1953,"approved",76,"comedy, horror, mystery",6.7,NA,"two bumbling american cops hunt for the mysterious mr. hyde in london, england.","charles lamont","bud abbott, lou costello, boris karloff, craig stevens",3453,NA
"52",52,"robot monster",1953,"approved",66,"sci-fi",2.9,NA,"the monstrous ro-man attempts to annihilate the last family alive on earth, but finds himself falling for their beautiful daughter.","phil tucker","george nader, gregory moffett, claudia barrett, selena royle",3786,NA
"53",53,"cat-women of the moon",1953,"approved",64,"adventure, sci-fi",3.7,NA,"astronauts travel to the moon where they discover it is inhabited by attractive young women in black tights.","arthur hilton","sonny tufts, victor jory, marie windsor, william phipps",1108,NA
"54",54,"lili",1953,"passed",81,"drama, musical, romance",7.5,NA,"an orphaned young woman becomes part of a puppet act and forms a relationship with the anti-social puppeteer.","charles walters","leslie caron, mel ferrer, jean-pierre aumont, zsa zsa gabor",2673,NA
"55",55,"the blue gardenia",1953,"not rated",90,"crime, drama, film-noir",7,NA,"a telephone operator ends up drunk and at the mercy of a cad in his apartment. the next morning she wakes up with a hangover and the terrible fear she may be a murderess.","fritz lang","anne baxter, richard conte, ann sothern, raymond burr",3665,NA
"56",56,"island in the sky",1953,"approved",109,"adventure, drama",7,NA,"a c-47 transport plane, named the corsair, makes a forced landing in the frozen wastes of labrador, and the plane's pilot, captain dooley, must keep his men alive in deadly conditions while waiting for rescue.","william a. wellman","john wayne, lloyd nolan, walter abel, james arness",2632,NA
"57",57,"the man from the alamo",1953,"approved",79,"western",6.5,NA,"during the alamo siege, john stroud is sent to ox bow to protect the townsfolk but, following a massacre, he infiltrates jess wade's gang of turncoat renegades supporting the mexicans.","budd boetticher","glenn ford, julie adams, chill wills, hugh o'brian",1241,NA
"58",58,"gunsmoke",1953,"approved",79,"romance, western",6.7,NA,"a young gun slinger tries to help a rancher and his daughter, save their land and cattle from an evil, wealthy land owner.","nathan juran","audie murphy, susan cabot, paul kelly, charles drake",598,NA
"59",59,"tumbleweed",1953,"approved",79,"western",6.8,NA,"jim harvey is hired to guard a small wagon train as it makes its way west. the train is attacked by indians and harvey, hoping to persuade aguila, the chief, to call off the attack due to ...                see full summary »","nathan juran","audie murphy, lori nelson, chill wills, roy roberts",376,NA
"60",60,"houdini",1953,"approved",106,"biography, drama",6.9,NA,"the spectacular but tragically short career of magician and illusionist harry houdini whose tricks defied explanation and safety.","george marshall","tony curtis, janet leigh, torin thatcher, angela clarke",2460,NA
"61",61,"the bigamist",1953,"approved",80,"drama, film-noir",6.8,NA,"harry and eve graham are trying to adopt a baby. the head of the agency senses harry is keeping a secret and does some investigating. he soon discovers harry has done an unusual amount of ...                see full summary »","ida lupino","joan fontaine, ida lupino, edmund gwenn, edmond o'brien",1887,NA
"62",62,"the maze",1953,"approved",80,"horror, sci-fi",5.9,NA,"a scotsman abruptly breaks off his engagement to pretty kitty and moves to his uncle's castle in the scottish highlands. kitty and her aunt follow gerald a few weeks later, and discover he ...                see full summary »","william cameron menzies","richard carlson, veronica hurst, katherine emery, michael pate",568,NA
"63",63,"miss sadie thompson",1953,"approved",91,"drama, musical, romance",6,NA,"a self-righteous missionary man seeks to save the soul of a former prostitute.","curtis bernhardt","rita hayworth, josé ferrer, aldo ray, russell collins",1098,NA
"64",64,"by the light of the silvery moon",1953,"approved",101,"comedy, family, musical",7.1,NA,"marjorie winfield's engagement to bill sherman, who has just arrived home from fighting in world war i, serves as the backdrop for the trials and tribulations of her family.","david butler","doris day, gordon macrae, leon ames, rosemary decamp",1585,NA
"65",65,"the moon is blue",1953,"m",99,"comedy, romance",6.8,NA,"two aging playboys are both after the same attractive young woman, but she fends them off by claiming that she plans to remain a virgin until her wedding night. both men determine to find a way around her objections.","otto preminger","william holden, david niven, maggie mcnamara, tom tully",1706,NA
"66",66,"indiscretion of an american wife",1953,"approved",63,"drama, romance",6.3,NA,"prior to leaving by train for paris, a married american woman tries to break off her affair with a young italian in rome's stazione termini.","vittorio de sica","jennifer jones, montgomery clift, gino cervi, richard beymer",1935,NA
"67",67,"sawdust and tinsel",1953,"not rated",93,"drama",7.7,NA,"the complicated relationships between a circus ringmaster, his estranged wife and his lover.","ingmar bergman","åke grönberg, harriet andersson, hasse ekman, anders ek",4568,NA
"68",68,"el",1953,"approved",82,"drama, romance",7.9,NA,"a husband's suave exterior unravels after his marriage, and he unleashes his paranoid and volatile temper on his wife, which escalates to more dangerous and unpredictable tantrums.","luis buñuel","arturo de córdova, delia garcés, aurora walker, carlos martínez baena",4310,NA
"69",69,"man in the attic",1953,"unrated",82,"film-noir, mystery, thriller",6.2,NA,"after an enigmatic, self-described pathologist rents the attic room of a victorian house, his landlady begins to suspect her lodger is jack the ripper.","hugo fregonese","jack palance, constance smith, byron palmer, frances bavier",999,NA
"70",70,"battle circus",1953,"approved",90,"romance, war, drama",5.8,NA,"set in korea and made during the war, this is the love story of a hard-bitten army surgeon, and a new nurse ready to save the world.","richard brooks","humphrey bogart, june allyson, keenan wynn, robert keith",1006,NA
"71",71,"gate of hell",1953,"not rated",89,"drama, history, romance",7.2,NA,"a samurai pursues a married lady-in-waiting.","teinosuke kinugasa","machiko kyô, kazuo hasegawa, isao yamagata, yatarô kurokawa",2366,NA
"72",72,"trouble along the way",1953,"approved",110,"comedy, drama, romance",6.9,NA,"struggling to retain custody of his daughter following his divorce, football coach steve williams finds himself embroiled in a recruiting scandal at the tiny catholic college he is trying ...                see full summary »","michael curtiz","john wayne, donna reed, charles coburn, tom tully",1262,NA
"73",73,"the titfield thunderbolt",1953,"not rated",84,"comedy",7.2,NA,"volunteers take over their local passenger train service (against bus company resistance) when the government announces its closure.","charles crichton","stanley holloway, george relph, naunton wayne, john gregson",2052,NA
"74",74,"salome",1953,"approved",103,"drama, history",5.9,NA,"after her banishment from rome, jewish princess salome returns to her roman-ruled native land of galilee where prophet john the baptist preaches against salome's parents, king herod and queen herodias.","william dieterle","rita hayworth, stewart granger, charles laughton, judith anderson",1193,NA
"75",75,"thunder bay",1953,"approved",103,"adventure, drama",6.6,NA,"shrimpers and oilmen clash when an ambitious wildcatter begins constructing an off-shore oilrig.","anthony mann","james stewart, joanne dru, gilbert roland, dan duryea",1192,NA
"76",76,"genevieve",1953,"approved",86,"comedy",7.3,NA,"it's time for the annual london to brighton antique car rally, and alan mckim and ambrose claverhouse are not going to let their friendship stop them from trying to humiliate each other. ...                see full summary »","henry cornelius","dinah sheridan, john gregson, kay kendall, kenneth more",2246,NA
"77",77,"welcome mr. marshall!",1953,NA,78,"comedy",8.2,NA,"after finding out that north american people are visiting the spanish villages, the citizens of villar del río start preparing themselves to welcome them when they arrive.","luis garcía berlanga","lolita sevilla, manolo morán, josé isbert, alberto romea",2867,NA
"78",78,"the man between",1953,"not rated",100,"drama, film-noir, thriller",7.1,NA,"in post-world war ii berlin, the british susanne mallison travels to berlin to visit her older brother martin mallison, a military who married german bettina mallison. the naive susanne ...                see full summary »","carol reed","james mason, claire bloom, hildegard knef, geoffrey toone",1159,NA
"79",79,"mesa of lost women",1953,"approved",70,"horror, sci-fi",2.5,NA,"a mad scientist named arana is creating giant spiders and dwarfs in his lab on zarpa mesa in mexico. he wants to create a master race of superwomen by injecting his female subjects with spider venom.","ron ormond, herbert tevos","jackie coogan, allan nixon, richard travis, lyle talbot",1079,NA
"80",80,"kuningas kulkureitten",1953,NA,80,"adventure, drama, history",4.8,NA,"add a plot","roland af hällström","tuija halonen, paavo hyttilä, leena häkinen, ekke hämäläinen",28,NA
"81",81,"ana-ta-han",1953,"approved",92,"drama, war",7.5,NA,"josef von sternberg directed, photographed, provides the voice-over narration and wrote the screenplay (from a based-on-actual event novel by michiro maruyana translated by younghill kang) ...                see full summary »","josef von sternberg","akemi negishi, tadashi suganuma, kisaburo sawamura, shôji nakayama",548,NA
"82",82,"pony express",1953,"approved",101,"history, romance, western",5.9,NA,"buffalo bill and wild bill hickock work to establish the pony express and fight indians and california separatists who seek to destroy it.","jerry hopper","charlton heston, rhonda fleming, jan sterling, forrest tucker",797,NA
"83",83,"knights of the round table",1953,"approved",115,"action, adventure, drama",6.3,NA,"king arthur's rule is threatened by the adulterous love between sir lancelot and queen guinevere, a relationship the king's enemies hope to exploit.","richard thorpe","robert taylor, ava gardner, mel ferrer, anne crawford",2687,NA
"84",84,"law and order",1953,"approved",80,"western",5.9,NA,"frame johnson already cleaned up tombstone and hopes to settle down near cottonwood. but a marshal's work is never done...","nathan juran","ronald reagan, dorothy malone, preston foster, alex nicol",489,NA
