"","rank","title","release_year","rating","runtime","genres","movie_rating","metascore","description","directors","actors","votes","gross_in_millions"
"84",84,"the buckaroo kid",1926,NA,64,"western",6.2,NA,"mulford sends ed harley to manage radigan's rundown ranch. he makes a success of it but when called to return, he asks radigan for a loan. radigan says he can have the loan but not his daughter, but ed wants both.","lynn reynolds","hoot gibson, ethel shannon, burr mcintosh, harry todd",6,NA
"85",85,"miss mend",1926,NA,250,"adventure, comedy, crime",7,NA,"three reporters and an office girl are trying to stop a bacteriological strike by some powerful western business leaders against the ussr.","boris barnet, fyodor otsep","natalya glan, igor ilyinsky, vladimir fogel, boris barnet",205,NA
"86",86,"the house without a key",1926,"passed",210,"action, adventure, crime",4.5,NA,"a pathe serial in ten chapters of two-reels each: dan winterslip, a wealthy man in honolulu, has not spoken to his brother, who owns a hotel next to winterslip's estate, in over twenty ...                see full summary »","spencer gordon bennet","allene ray, walter miller, e.h. calvert, betty caldwell",15,NA
"87",87,"syncopating sue",1926,NA,70,NA,NA,NA,"add a plot","richard wallace",NA,NA,NA
"88",88,"irene",1926,NA,90,"comedy, romance",7.2,NA,"irene, a feisty irish girl in philadelphia, clashes with her family and walks out, heading to new york city to seek fame and fortune. she gets a job as a dressmaker's model and becomes ...                see full summary »","alfred e. green","colleen moore, lloyd hughes, george k. arthur, charles murray",39,NA
"89",89,"made for love",1926,NA,72,"drama, romance",7.4,NA,"a young woman visits her boyfriend, an archaeologist, at the site in egypt where he is digging up ancient artifacts. her frustration mounts when it appears that he is more interested in old...                see full summary »","paul sloane","leatrice joy, edmund burns, ethel wales, bertram grassby",17,NA
"90",90,"the blue eagle",1926,"passed",58,"action, drama",5.6,NA,"george and big jim are comrades in the navy but rivals outside it, both fighting for the love of rose, the local policeman's daughter. when the war is over father regan tries to unite them ...                see full summary »","john ford","george o'brien, janet gaynor, william russell, margaret livingston",113,NA
"91",91,"wenn menschen irren. frauen auf irrwegen",1926,NA,NA,NA,NA,NA,"add a plot","otz tollen",NA,NA,NA
"92",92,"the cohens and kellys",1926,NA,80,"comedy",6.8,NA,"add a plot","harry a. pollard","charles murray, george sidney, vera gordon, kate price",5,NA
"93",93,"the little irish girl",1926,NA,67,"crime, drama",1.5,NA,"beautiful dot walker is part of a ring of crooks in san francisco, who use her to lure impressionable young men into a crooked card game. young johnny has come to the big city to sell his ...                see full summary »","roy del ruth","dolores costello, john harron, matthew betz, lee moran",10,NA
"94",94,"la femme nue",1926,NA,NA,NA,NA,NA,"add a plot","léonce perret","iván petrovich, louise lagrange, nita naldi, andré nox",7,NA
"95",95,"so's your old man",1926,NA,67,"comedy",6.8,NA,"poor glazier sam bisbee has invented break-proof glass. he intends to show it off to a convention of automobile men. due to a mixup his car is switched with another and his demonstration ...                see full summary »","gregory la cava","w.c. fields, alice joyce, charles 'buddy' rogers, kittens reichert",128,NA
"96",96,"the third degree",1926,NA,80,"romance",5.6,NA,"add a plot","michael curtiz","dolores costello, louise dresser, rockliffe fellowes, jason robards sr.",19,NA
"97",97,"fascinating youth",1926,"passed",70,"comedy, romance, sport",9,NA,"playboy teddy ward wants to marry jeannie king, an artist, but his father wants him to marry loris lane, but tells teddy he can marry whom he pleases if he will make the mountain inn a ...                see full summary »","sam wood","charles 'buddy' rogers, ivy harris, jack luden, roland drew",9,NA
"98",98,"the caveman",1926,NA,70,"comedy",4.2,NA,"a bored society girl cuts a $100 bill in half, writes a message on one half for whoever finds it to call her at her apartment, writes the address on the bill and throws it out the window of...                see full summary »","lewis milestone","matt moore, marie prevost, john patrick, myrna loy",12,NA
"99",99,"a social celebrity",1926,NA,70,"comedy",8.2,NA,"small-town barber max haber ( adolphe menjou ), is the pride of his father, johann, who owns an antiquated barbershop. max adores kitty laverne ( louise brooks ), the manicurist, who loves ...                see full summary »","malcolm st. clair","adolphe menjou, louise brooks, eleanor lawson, roger davis",6,NA
"100",100,"lovey mary",1926,NA,70,NA,NA,NA,"lovely mary, an orphan girl, reluctantly takes charge of her sister's child when her sister kate is jailed.","king baggot",NA,NA,NA
