"","rank","title","release_year","rating","runtime","genres","movie_rating","metascore","description","directors","actors","votes","gross_in_millions"
"82",82,"decision before dawn",1951,"not rated",119,"drama, war",7.4,NA,"as the us army approaches nazi germany, they recruit german prisoners to spy behind german lines.","anatole litvak","richard basehart, gary merrill, oskar werner, hildegard knef",1885,NA
"83",83,"the magic carpet",1951,"approved",84,"adventure, fantasy",5.2,NA,"abdullah (john agar)has reached manhood as the son of a physician without knowing he is the true caliph of islam. stirred by the conditions in his country, he infiltrates the palace and ...                see full summary »","lew landers","lucille ball, john agar, patricia medina, george tobias",182,NA
"84",84,"the fat man",1951,"passed",78,"crime, drama, film-noir",6.5,NA,"a dentist's murder is investigated by hefty sleuth brad runyan.","william castle","j. scott smart, julie london, rock hudson, clinton sundberg",223,NA
"85",85,"lost continent",1951,"passed",83,"sci-fi",3,NA,"major joe nolan heads a rescue mission in the south pacific to recover a downed atomic rocket. the crew crashlands on a mysterious island, and spends much time rock-climbing. they meet up ...                see full summary »","sam newfield","cesar romero, hillary brooke, chick chandler, john hoyt",1111,NA
"86",86,"the great caruso",1951,"approved",109,"biography, drama, music",6.7,NA,"loosely traces the life of tenor enrico caruso (1873-1921). he loves musetta, in his home town of naples, and then dorothy, the daughter of one of the metropolitan opera's patrons. caruso ...                see full summary »","richard thorpe","mario lanza, ann blyth, dorothy kirsten, jarmila novotna",1007,NA
"87",87,"the stooge",1951,"not rated",100,"comedy, drama, musical",6.9,NA,"egotistical vaudevillian bill miller basks in the limelight with his successful musical-comedy act, but his success is due to his unheralded second banana.","norman taurog","dean martin, jerry lewis, polly bergen, marion marshall",1053,NA
"88",88,"flight to mars",1951,"not rated",72,"sci-fi",5.2,NA,"five astronauts successfully fly to mars where they encounter seemingly friendly and advanced inhabitants who harbor covert plans to use their ship to invade earth.","lesley selander","marguerite chapman, cameron mitchell, arthur franz, virginia huston",698,NA
"89",89,"the strange door",1951,"approved",81,"film-noir, horror, thriller",6.4,NA,"noble-born cad denis (stapley) has been tricked into a forced stay at the eerie manor of the sire de maletroit (laughton), an evil madman who can't get over the death of his beloved, twenty...                see full summary »","joseph pevney","charles laughton, boris karloff, sally forrest, richard wyler",561,NA
"90",90,"go for broke!",1951,"passed",92,"drama, history, war",6.8,NA,"the story of japanese-american soldiers who fought in europe during world war ii.","robert pirosh","van johnson, lane nakano, george miki, akira fukunaga",993,NA
"91",91,"texas carnival",1951,"passed",77,"comedy, music, romance",5.7,NA,"a showmen team is mistaken for a cattle baron and his sister.","charles walters","esther williams, red skelton, howard keel, ann miller",338,NA
"92",92,"ten tall men",1951,"approved",97,"action, adventure",6.3,NA,"during the rif war in morocco, the french foreign legion's outpost of tarfa is threatened by khalif hussein's tribes but sergeant mike kincaid devises a plan of survival until the arrival of french reinforcements.","willis goldbeck","burt lancaster, jody lawrance, gilbert roland, kieron moore",648,NA
"93",93,"variety lights",1951,"not rated",93,"drama, music, romance",7.2,NA,"a beautiful but ambitious young woman joins a traveling troupe of third-rate vaudevillians and inadvertently causes jealousy and emotional crises.","federico fellini, alberto lattuada","peppino de filippo, carla del poggio, giulietta masina, john kitzmiller",2147,NA
"94",94,"rich, young and pretty",1951,"passed",95,"comedy, musical, romance",5.8,NA,"jim stauton rogers, a texas rancher turned international diplomat, take his young daughter, elizabeth rogers, on a trip to paris. he is concerned that his daughter might come in contact ...                see full summary »","norman taurog","jane powell, danielle darrieux, wendell corey, vic damone",292,NA
"95",95,"miracle in milan",1951,"not rated",100,"comedy, drama, fantasy",7.8,NA,"an open hearted and unrelentingly energetic orphan struggles to make the best out of his life on the street.","vittorio de sica","emma gramatica, francesco golisano, paolo stoppa, guglielmo barnabò",4739,NA
"96",96,"bikini baby",1951,NA,90,"comedy",6.1,NA,"an unsophisticated and impressionable young girl finds herself in trouble after winning a beauty pageant.","frank launder","dennis price, john mccallum, stanley holloway, pauline stroud",129,NA
"97",97,"la poison",1951,"not rated",85,"comedy, crime",7.7,NA,"through a series of circumstances and plot twists an enterprising man manages to get away with murdering his wife, even though he cheerfully admits his guilt in court.","sacha guitry","michel simon, jean debucourt, jacques varennes, jeanne fusier-gir",676,NA
"98",98,"he ran all the way",1951,"not rated",77,"crime, drama, film-noir",7.1,NA,"nick and his partner al stage a payroll holdup. al is shot and nick kills a policeman. nick hides out at a public pool, where he meets peg dobbs. they go back to her apartment and he forces her family to hide him from the police manhunt.","john berry","john garfield, shelley winters, wallace ford, selena royle",1377,NA
"99",99,"laughter in paradise",1951,"not rated",93,"comedy",7.2,NA,"when a millionaire practical joker dies, he divides his fortune among four heirs who must carry out his zany instructions to cash in.","mario zampi","alastair sim, fay compton, guy middleton, george cole",978,NA
"100",100,"man in the saddle",1951,"approved",87,"romance, western",6.4,NA,"a private deadly feud ensues when ruthless wealthy rancher will isham attempts a takeover of small rancher owen merritt's land and marries owen's old flame, laure bidwell.","andré de toth","randolph scott, joan leslie, ellen drew, alexander knox",790,NA
