"","rank","title","release_year","rating","runtime","genres","movie_rating","metascore","description","directors","actors","votes","gross_in_millions"
"85",85,"the fantastic four",1994,"pg",90,"action, adventure, family",3.9,NA,"in this marvel comic adaption, four astronauts get bombarded with cosmic rays when an accident occurs. the four of them acquire special powers, and decide to form a superhero group called ...                see full summary »","oley sassone","alex hyde-white, jay underwood, rebecca staab, michael bailey smith",3834,NA
"86",86,"iron will",1994,"pg",108,"adventure, family",6.5,NA,"when will stoneman's father dies, he is left alone to take care of his mother and their land. needing money to maintain it, he decides to join a cross country dogsled race. this race will ...                see full summary »","charles haid","mackenzie astin, kevin spacey, david ogden stiers, august schellenberg",6146,NA
"87",87,"the legend of drunken master",1994,"r",102,"action, comedy",7.6,"74","a young martial artist is caught between respecting his pacifist father's wishes or stopping a group of disrespectful foreigners from stealing precious artifacts.","chia-liang liu","jackie chan, ho-sung pak, lung ti, anita mui",37344,NA
"88",88,"shallow grave",1994,"r",89,"crime, thriller",7.3,"67","three friends discover their new flatmate dead but loaded with cash.","danny boyle","kerry fox, christopher eccleston, ewan mcgregor, ken stott",49379,NA
"89",89,"nobody's fool",1994,"r",110,"comedy, drama",7.4,NA,"a stubborn man past his prime reflects his life of strict independence and seeks more out of himself.","robert benton","paul newman, bruce willis, jessica tandy, melanie griffith",15804,NA
"90",90,"the getaway",1994,"r",115,"action, adventure, crime",5.7,NA,"an ex-con and his devoted wife must flee from danger when a heist doesn't go as planned.","roger donaldson","alec baldwin, kim basinger, michael madsen, james woods",14961,NA
"91",91,"camp nowhere",1994,"pg",96,"adventure, comedy, family",6,NA,"morris ""mud"" himmel has a problem. his parents desperately want to send him away to summer camp. he hates going to summer camp, and would do anything to get out of it. talking to his ...                see full summary »","jonathan prince","jonathan jackson, christopher lloyd, john putch, peter scolari",7702,NA
"92",92,"threesome",1994,"r",89,"comedy, romance, drama",6.2,NA,"eddy and stuart share two-thirds of a dormitory suite. due to bureaucratic error, a woman named alex is added to their room. at first, relations among the three are tense. soon, however, ...                see full summary »","andrew fleming","lara flynn boyle, josh charles, stephen baldwin, alexis arquette",11439,NA
"93",93,"north",1994,"pg",87,"adventure, comedy, drama",4.4,NA,"sick of the neglect he receives from his mom and dad, a young boy leaves home and travels the world in search of new parents.","rob reiner","elijah wood, bruce willis, jason alexander, julia louis-dreyfus",11894,NA
"94",94,"funny man",1994,"r",90,"comedy, horror",4.7,NA,"when max taylor wins the ancestral home of callum chance in a game of poker, little does he realise that the game is far from over... one by one, max's family are murdered by the funny man,...                see full summary »","simon sprackling","tim james, christopher lee, benny young, ingrid lacey",827,NA
"95",95,"thumbelina",1994,"g",86,"animation, family, fantasy",6.4,NA,"the tiny girl meets a fairy prince who saves her from the creatures of the woods.","don bluth, gary goldman","jodi benson, gary imhoff, gino conforti, barbara cook",12557,NA
"96",96,"bad girls",1994,"r",99,"romance, western",5.1,NA,"four prostitutes join together to travel the old west.","jonathan kaplan","madeleine stowe, mary stuart masterson, andie macdowell, drew barrymore",10233,NA
"97",97,"crooklyn",1994,"pg-13",115,"comedy, drama",6.9,"65","spike lee's vibrant semi-autobiographical portrait of a school teacher, her stubborn jazz musician husband and their five kids living in brooklyn in 1973.","spike lee","alfre woodard, delroy lindo, david patrick kelly, zelda harris",6628,NA
"98",98,"monkey trouble",1994,"pg",96,"adventure, comedy, family",5.3,NA,"a young girl's life turns hairy when her new pet monkey turns out to be a trained pickpocket on the run from a scheming gypsy.","franco amurri","thora birch, harvey keitel, finster, mimi rogers",5417,NA
"99",99,"the shadow",1994,"pg-13",108,"action, adventure, crime",6,NA,"in 1930's new york city, the shadow battles his nemesis, shiwan khan, who is building an atomic bomb.","russell mulcahy","alec baldwin, john lone, penelope ann miller, peter boyle",20030,NA
"100",100,"serial mom",1994,"r",95,"comedy, crime, thriller",6.7,NA,"a sweet mother takes a little too much at heart for the defense of her family.","john waters","kathleen turner, sam waterston, ricki lake, matthew lillard",22624,NA
