"","rank","title","release_year","rating","runtime","genres","movie_rating","metascore","description","directors","actors","votes","gross_in_millions"
"85",85,"flubber",1997,"pg",93,"comedy, family, sci-fi",5.2,"37","an absent-minded professor discovers ""flubber"", a rubber-like super-bouncy substance.","les mayfield","robin williams, marcia gay harden, christopher mcdonald, ted levine",70372,NA
"86",86,"rocketman",1997,"pg",95,"comedy, family, sci-fi",5.9,NA,"fred z. randall is a geeky and obnoxious spacecraft designer, who gets the chance to make his dream come true and travel to mars as a member of the first manned flight there.","stuart gillard","harland williams, jessica lundy, william sadler, jeffrey demunn",7784,NA
"87",87,"air bud",1997,"pg",98,"comedy, drama, family",5.1,NA,"a young boy and a talented stray dog with an amazing basketball playing ability become instant friends. rebounding from his father's accidental death, 12-year-old josh framm moves with his ...                see full summary »","charles martin smith","michael jeter, kevin zegers, wendy makkena, bill cobbs",13984,NA
"88",88,"u turn",1997,"r",125,"crime, drama, thriller",6.8,"54","a man heading to vegas to pay off his gambling debt before the russian mafia kills him, is forced to stop in an arizona town where everything that can go wrong, does go wrong.","oliver stone","sean penn, jennifer lopez, nick nolte, billy bob thornton",44249,NA
"89",89,"beverly hills ninja",1997,"pg-13",88,"action, comedy",5.5,"27","a man tries to rescue a woman with a little help from his half brother.","dennis dugan","chris farley, nicollette sheridan, robin shou, nathaniel parker",33073,NA
"90",90,"in & out",1997,"pg-13",90,"comedy, romance",6.3,"70","a midwestern teacher questions his sexuality after a former student makes a comment about him at the academy awards.","frank oz","kevin kline, joan cusack, tom selleck, matt dillon",34030,NA
"91",91,"the boxer",1997,"r",113,"drama, romance, sport",7.1,"75","young danny flynn is released from prison after 14 years after ""taking the rap"" for the ira and tries to rebuild his life in his old belfast neighborhood.","jim sheridan","daniel day-lewis, daragh donnelly, frank coughlan, sean kearns",15528,NA
"92",92,"the castle",1997,"r",85,"comedy, drama",7.7,NA,"a working-class family from melbourne, australia fights city hall after being told they must vacate their beloved family home to allow for infrastructural expansion.","rob sitch","michael caton, anne tenney, stephen curry, anthony simcoe",12816,NA
"93",93,"picture perfect",1997,"pg-13",105,"comedy, drama, romance",5.5,"44","a young advertising executive's life becomes increasingly complicated when, in order to impress her boss, she pretends to be engaged to a man she has just met.","glenn gordon caron","jennifer aniston, jay mohr, kevin bacon, olympia dukakis",16955,NA
"94",94,"breakdown",1997,"r",93,"action, crime, drama",6.9,"73","a man searches for his missing wife after his car breaks down in the middle of the desert.","jonathan mostow","kurt russell, j.t. walsh, kathleen quinlan, m.c. gainey",41117,NA
"95",95,"wild america",1997,"pg",106,"action, adventure, comedy",6.3,NA,"three brothers who are obsessed with animals are given permission from their parents to travel around america with a camera documenting wildlife.","william dear","jonathan taylor thomas, devon sawa, scott bairstow, frances fisher",5783,NA
"96",96,"soul food",1997,"r",115,"comedy, drama",7,"68","one person can keep a family together and, when that one person is gone, a family can be torn apart.","george tillman jr.","vanessa williams, vivica a. fox, nia long, michael beach",5793,NA
"97",97,"fools rush in",1997,"pg-13",109,"comedy, drama, romance",6,"37","after a one night stand with alex, isabel realizes that she is pregnant and they decide to get married. however, along with the marriage comes compromise of one's own cultural traditions.","andy tennant","matthew perry, salma hayek, jon tenney, carlos gómez",29060,NA
"98",98,"b*a*p*s",1997,"pg-13",91,"comedy",4.1,NA,"two tacky homegirls move to l.a. to become dancers; instead they scam a dying millionaire but eventually become b*a*p*s (black american princesses).","robert townsend","halle berry, natalie desselle reid, martin landau, ian richardson",3010,NA
"99",99,"another nine & a half weeks",1997,"r",105,"drama, romance",2.8,NA,"when john travels to paris to attend an art sale hosted by his old flame, he begins a torrid affair with a gorgeous woman (angie everhart) who used to be her best friend. as the erotic ...                see full summary »","anne goursaud","mickey rourke, agathe de la fontaine, angie everhart, steven berkoff",3737,NA
"100",100,"nothing to lose",1997,"r",98,"action, adventure, comedy",6.7,NA,"when a man (robbins) believes he has discovered that his wife is having an affair with his boss, it sets off a chain reaction of events. first he wanders into a ghetto where a robber (...                see full summary »","steve oedekerk","martin lawrence, tim robbins, john c. mcginley, giancarlo esposito",38264,NA
