"","rank","title","release_year","rating","runtime","genres","movie_rating","metascore","description","directors","actors","votes","gross_in_millions"
"77",77,"the longest ride",2015,"pg-13",123,"drama, romance",7.1,"33","the lives of a young couple intertwine with a much older man, as he reflects back on a past love.","george tillman jr.","scott eastwood, britt robertson, alan alda, jack huston",61817,NA
"78",78,"joy",2015,"pg-13",124,"biography, drama",6.6,"56","joy is the story of the title character, who rose to become founder and matriarch of a powerful family business dynasty.","david o. russell","jennifer lawrence, robert de niro, bradley cooper, edgar ramírez",103288,NA
"79",79,"secret in their eyes",2015,"pg-13",111,"crime, drama, mystery",6.2,"45","a tight-knit team of rising investigators, along with their supervisor, is suddenly torn apart when they discover that one of their own teenage daughters has been brutally murdered.","billy ray","chiwetel ejiofor, nicole kidman, julia roberts, dean norris",29841,NA
"80",80,"youth",2015,"r",124,"comedy, drama, music",7.3,"64","a retired orchestra conductor is on holiday with his daughter and his film best friend in the alps when he receives an invitation from queen elizabeth ii to perform for prince philip's birthday.","paolo sorrentino","michael caine, harvey keitel, rachel weisz, jane fonda",56046,NA
"81",81,"burnt",2015,"r",101,"comedy, drama",6.6,"42","adam jones (bradley cooper) is a chef who destroyed his career with drugs and diva behavior. he cleans up and returns to london, determined to redeem himself by spearheading a top restaurant that can gain three michelin stars.","john wells","bradley cooper, sienna miller, daniel brühl, riccardo scamarcio",81779,NA
"82",82,"point break",2015,"pg-13",114,"action, crime, sport",5.3,"34","a young fbi agent infiltrates an extraordinary team of extreme sports athletes he suspects of masterminding a string of unprecedented, sophisticated corporate heists.","ericson core","edgar ramírez, luke bracey, ray winstone, teresa palmer",47407,NA
"83",83,"the ridiculous 6",2015,"tv-14",119,"comedy, western",4.8,"18","an outlaw who was raised by native americans discovers that he has five half-brothers; together the men go on a mission to find their wayward, deadbeat dad.","frank coraci","adam sandler, terry crews, jorge garcia, taylor lautner",32810,NA
"84",84,"child 44",2015,"r",137,"crime, drama, thriller",6.5,"41","a disgraced member of the russian military police investigates a series of child murders during the stalin-era soviet union.","daniel espinosa","tom hardy, gary oldman, noomi rapace, joel kinnaman",51059,NA
"85",85,"pixels",2015,"pg-13",105,"action, comedy, family",5.6,"27","when aliens misinterpret video feeds of classic arcade games as a declaration of war, they attack the earth in the form of the video games.","chris columbus","adam sandler, kevin james, michelle monaghan, peter dinklage",106924,NA
"86",86,"the night before",2015,"r",101,"adventure, comedy, fantasy",6.4,"58","on christmas eve, three lifelong friends spend the night in new york city looking for the holy grail of christmas parties.","jonathan levine","joseph gordon-levitt, seth rogen, jillian bell, lizzy caplan",47071,NA
"87",87,"the dressmaker",2015,"r",119,"comedy, drama",7.1,"47","a glamorous woman returns to her small town in rural australia. with her sewing machine and haute couture style, she transforms the women and exacts sweet revenge on those who did her wrong.","jocelyn moorhouse","kate winslet, judy davis, liam hemsworth, hugo weaving",37463,NA
"88",88,"bahubali: the beginning",2015,NA,159,"action, adventure, drama",8.2,NA,"in ancient india, an adventurous and daring man becomes involved in a decades old feud between two warring people.","s.s. rajamouli","prabhas, rana daggubati, anushka shetty, tamannaah bhatia",82114,NA
"89",89,"ted 2",2015,"r",115,"comedy",6.3,"48","newlywed couple ted and tami-lynn want to have a baby, but in order to qualify to be a parent, ted will have to prove he's a person in a court of law.","seth macfarlane","mark wahlberg, seth macfarlane, amanda seyfried, jessica barth",144616,NA
"90",90,"self/less",2015,"pg-13",117,"action, mystery, sci-fi",6.5,"34","a dying real estate mogul transfers his consciousness into a healthy young body, but soon finds that neither the procedure nor the company that performed it are quite what they seem.","tarsem singh","ryan reynolds, natalie martinez, matthew goode, ben kingsley",71285,NA
"91",91,"demolition",2015,"r",101,"comedy, drama",7,"49","a successful investment banker struggles after losing his wife in a tragic car crash. with the help of a customer service rep and her young son, he starts to rebuild, beginning with the demolition of the life he once knew.","jean-marc vallée","jake gyllenhaal, naomi watts, chris cooper, judah lewis",65224,NA
"92",92,"steve jobs",2015,"r",122,"biography, drama",7.2,"82","steve jobs takes us behind the scenes of the digital revolution, to paint a portrait of the man at its epicenter. the story unfolds backstage at three iconic product launches, ending in 1998 with the unveiling of the imac.","danny boyle","michael fassbender, kate winslet, seth rogen, jeff daniels",122904,NA
"93",93,"the last witch hunter",2015,"pg-13",106,"action, adventure, fantasy",6,"34","the last witch hunter is all that stands between humanity and the combined forces of the most horrifying witches in history.","breck eisner","vin diesel, rose leslie, elijah wood, ólafur darri ólafsson",75717,NA
"94",94,"knight of cups",2015,"r",118,"drama, romance",5.7,"53","a writer indulging in all that los angeles and las vegas has to offer undertakes a search for love and self via a series of adventures with six different women.","terrence malick","christian bale, cate blanchett, natalie portman, brian dennehy",19035,NA
"95",95,"the stanford prison experiment",2015,"r",122,"biography, drama, history",6.9,"67","twenty-four male students out of seventy-five were selected to take on randomly assigned roles of prisoners and guards in a mock prison situated in the basement of the stanford psychology building.","kyle patrick alvarez","ezra miller, tye sheridan, billy crudup, olivia thirlby",24209,NA
"96",96,"victor frankenstein",2015,"pg-13",110,"drama, horror, sci-fi",6,"36","told from igor's perspective, we see the troubled young assistant's dark origins, his redemptive friendship with the young medical student viktor von frankenstein, and become eyewitnesses to the emergence of how frankenstein became the man - and the legend - we know today.","paul mcguigan","daniel radcliffe, james mcavoy, jessica brown findlay, andrew scott",41129,NA
"97",97,"magic mike xxl",2015,"r",115,"comedy, drama, music",5.6,"60","three years after mike bowed out of the stripper life at the top of his game, he and the remaining kings of tampa hit the road to myrtle beach to put on one last blow-out performance.","gregory jacobs","channing tatum, joe manganiello, matt bomer, adam rodriguez",44273,NA
"98",98,"paper towns",2015,"pg-13",109,"drama, mystery, romance",6.3,"56","after an all night adventure, quentin's life-long crush, margo, disappears, leaving behind clues that quentin and his friends follow on the journey of a life-time.","jake schreier","nat wolff, cara delevingne, austin abrams, justice smith",77386,NA
"99",99,"córki dancingu",2015,"not rated",92,"comedy, drama, horror",6.3,"72","in warsaw, a pair of mermaid sisters are adopted into a cabaret. while one seeks love with humans the other hungers to dine on the human population of the city.","agnieszka smoczynska","marta mazurek, michalina olszanska, kinga preis, andrzej konopka",2379,NA
"100",100,"hardcore henry",2015,"r",96,"action, adventure, sci-fi",6.7,"51","henry is resurrected from death with no memory, and he must save his wife from a telekinetic warlord with a plan to bio-engineer soldiers.","ilya naishuller","sharlto copley, tim roth, haley bennett, danila kozlovsky",65870,NA
