"","rank","title","release_year","rating","runtime","genres","movie_rating","metascore","description","directors","actors","votes","gross_in_millions"
"85",85,"who's harry crumb?",1989,"pg-13",94,"comedy, mystery",5.8,NA,"harry crumb is a bumbling and inept private investigator who is hired to solve the kidnapping of a young heiress which he's not expected to solve because his employer is the mastermind behind the kidnapping.","paul flaherty","john candy, jeffrey jones, annie potts, tim thomerson",13431,NA
"86",86,"the fabulous baker boys",1989,"r",114,"drama, music, romance",6.8,NA,"the lives of two struggling musicians, who happen to be brothers, inevitably change when they team up with a beautiful, up-and-coming singer.","steve kloves","jeff bridges, michelle pfeiffer, beau bridges, ellie raab",18851,NA
"87",87,"shag",1989,"pg",98,"comedy, drama, romance",6.3,NA,"summer of 1963. carson is getting married to her boyfriend so her friends melaina, pudge and luanne take her to myrtle beach for one last irresponsible weekend.","zelda barron","phoebe cates, bridget fonda, scott coffey, annabeth gish",3229,NA
"88",88,"blind fury",1989,"r",86,"action, comedy, crime",6.3,NA,"a blind vietnam vet, trained as a swordfighter, comes to america and helps to rescue the son of a fellow soldier.","phillip noyce","rutger hauer, terry o'quinn, brandon call, noble willingham",11674,NA
"89",89,"meet the feebles",1989,"not rated",97,"comedy, music, musical",6.7,NA,"multiple animals and insects experience the sleazier side of show business while working on a variety show.","peter jackson","danny mulheron, donna akersten, stuart devenie, mark hadlow",16690,NA
"90",90,"deepstar six",1989,"r",99,"action, horror, sci-fi",5.2,NA,"at the bottom of the ocean, the deepstar six has just discovered a new and deadly alien menace.","sean s. cunningham","greg evigan, nancy everhard, taurean blacque, miguel ferrer",7751,NA
"91",91,"tetsuo, the iron man",1989,"not rated",67,"horror, sci-fi",7,NA,"a businessman accidentally kills the metal fetishist, who gets his revenge by slowly turning the man into a grotesque hybrid of flesh and rusty metal.","shin'ya tsukamoto","kei fujiwara, tomorô taguchi, nobu kanaoka, shin'ya tsukamoto",15529,NA
"92",92,"blue steel",1989,"r",102,"action, crime, drama",5.6,NA,"a female rookie in the police force must engage in a cat-and-mouse game with a pistol-wielding psychopath who becomes obsessed with her.","kathryn bigelow","jamie lee curtis, ron silver, clancy brown, elizabeth peña",9997,NA
"93",93,"uhf",1989,"pg-13",97,"comedy, drama",7,"32","an unemployed visionary becomes the manager of a local public station. the station becomes a success, with all sorts of hilarious sight gags and wacky humor.","jay levey","'weird al' yankovic, victoria jackson, kevin mccarthy, michael richards",22475,NA
"94",94,"cutting class",1989,"r",91,"comedy, crime, horror",4.2,NA,"a murderer is loose in a high school in this 'whodunit' movie.","rospo pallenberg","donovan leitch jr., jill schoelen, brad pitt, roddy mcdowall",3444,NA
"95",95,"the killer",1989,"r",111,"action, crime, drama",7.9,NA,"a disillusioned assassin accepts one last hit in hopes of using his earnings to restore vision to a singer he accidentally blinded, only to be double-crossed by his boss.","john woo","yun-fat chow, danny lee, sally yeh, kong chu",40864,NA
"96",96,"chances are",1989,"pg",108,"comedy, fantasy, romance",6.4,NA,"a reincarnated man unknowingly falls in love with his own daughter from his previous life. once he realizes this, he tries to end their relationship before angels erase his memory.","emile ardolino","cybill shepherd, robert downey jr., ryan o'neal, mary stuart masterson",9135,NA
"97",97,"intruder",1989,"r",83,"horror, thriller",6.4,NA,"the overnight stock crew of a local supermarket find themselves being stalked and slashed by a mysterious maniac.","scott spiegel","elizabeth cox, renée estevez, dan hicks, david byrnes",5528,NA
"98",98,"shirley valentine",1989,"r",108,"comedy, drama, romance",7.2,NA,"shirley's a middle-aged liverpool housewife, who finds herself talking to the wall while she prepares her husband's chip'n'egg, wondering what happened to her life. she compares scenes in ...                see full summary »","lewis gilbert","pauline collins, tom conti, julia mckenzie, alison steadman",5740,NA
"99",99,"fat man and little boy",1989,"pg-13",127,"biography, drama, history",6.5,NA,"this film reenacts the manhattan project, the secret wartime project in new mexico where the first atomic bombs were designed and built.","roland joffé","paul newman, dwight schultz, bonnie bedelia, john cusack",5841,NA
"100",100,"death spa",1989,"r",88,"horror",5.1,NA,"bodies begin to mysterious pile up at a hip los angeles health club.","michael fischa","william bumiller, brenda bakke, merritt butrick, robert lipton",1219,NA
