"","rank","title","release_year","rating","runtime","genres","movie_rating","metascore","description","directors","actors","votes","gross_in_millions"
"85",85,"king of the khyber rifles",1953,"approved",100,"adventure, drama, history",6.4,NA,"a half-caste british officer in 19th-century india battles the prejudices of both his army colleagues and the local populace while trying to help put down a rebellion led by a greedy local ruler.","henry king","tyrone power, terry moore, michael rennie, john justin",546,NA
"86",86,"fair wind to java",1953,"approved",92,"action, adventure, drama",6,NA,"in 1883, an american merchant ship's captain is searching for a treasure in diamonds from a sunken dutch ship in the vicinity of a volcanic island in the dutch east indies.","joseph kane","fred macmurray, vera ralston, robert douglas, victor mclaglen",211,NA
"87",87,"the lone hand",1953,"approved",80,"western",6.7,NA,"in 1870, widowed farmer zachary hallock secretly joins a group of outlaws as a solution to his money problems.","george sherman","joel mccrea, barbara hale, alex nicol, charles drake",236,NA
"88",88,"donovan's brain",1953,"approved",84,"sci-fi, horror",6,NA,"yet another version of curt siodmak's novel about an honest scientist who keeps the brain of a ruthless dead millionaire (donovan) alive in a tank. donovan manages to impose his powerful ...                see full summary »","felix e. feist","lew ayres, gene evans, nancy reagan, steve brodie",1158,NA
"89",89,"inferno",1953,"approved",83,"crime, drama, romance",7.2,NA,"a tough, hard-driving business tycoon suffers a broken leg and is left to die in the desert by his scheming wife and her greedy lover.","roy ward baker","robert ryan, rhonda fleming, william lundigan, larry keating",816,NA
"90",90,"little fugitive",1953,"not rated",80,"drama, family",7.6,"91","a young boy fears that he shot his older brother, who is only faking. he then runs away to coney island, a crowded beach area, and gets money by returning soda bottles for their deposits.","ray ashley, morris engel, ruth orkin","richard brewster, winifred cushing, jay williams, will lee",1925,NA
"91",91,"the magnetic monster",1953,"approved",76,"sci-fi",5.9,NA,"working for o.s.i., the office of scientific investigation, a-man agent jeffrey stewart and his partner dan forbes are sent to a local hardware store where they find a strong magnetic field...                see full summary »","curt siodmak, herbert l. strock","richard carlson, king donovan, jean byron, harry ellerbe",812,NA
"92",92,"return to paradise",1953,"approved",100,"adventure, drama, romance",6.1,NA,"an american drifter comes to a remote polynesian island controlled by a puritanical missionary and turns the social life of the island upside-down.","mark robson","gary cooper, barry jones, roberta haynes, moira walker",420,NA
"93",93,"the actress",1953,"passed",90,"biography, comedy, drama",6.6,NA,"former seaman clinton jones now works at a lowly job. his daughter ruth wants to become an actress. clinton gets fired and ruth rejects the advances of fred whitmarsh. her father gives her ...                see full summary »","george cukor","spencer tracy, jean simmons, teresa wright, anthony perkins",926,NA
"94",94,"woman they almost lynched",1953,"approved",90,"western",6.7,NA,"laying on the missouri-arkansas border, the neutral border city, its female mayor and city council, take no side in the ongoing civil war and they're prepared to hang any troublemaker, yankee or confederate, who stirs the townsfolk up.","allan dwan","john lund, brian donlevy, audrey totter, joan leslie",181,NA
"95",95,"vicki",1953,"approved",85,"crime, drama, film-noir",6.5,NA,"the untimely murder of a new york glamor-girl sparks an investigation with an emotionally driven detective at the helm.","harry horner","jeanne crain, jean peters, elliott reid, richard boone",699,NA
"96",96,"the lawless breed",1953,"not rated",83,"western",6.4,NA,"after being released from prison, former gun-fighter john wesley hardin hopes to have his autobiography published in order to rehabilitate his tarnished reputation.","raoul walsh","rock hudson, julie adams, mary castle, john mcintire",780,NA
"97",97,"the lady without camelias",1953,NA,101,"drama",7.2,NA,"a new starlet is discovered and has ups and downs in italian films.","michelangelo antonioni","lucia bosé, gino cervi, andrea checchi, ivan desny",1013,NA
"98",98,"turn the key softly",1953,NA,81,"crime, drama",6.9,NA,"after three women are released from prison, we follow them for their first day of freedom.","jack lee","yvonne mitchell, terence morgan, joan collins, kathleen harrison",225,NA
"99",99,"abbott and costello go to mars",1953,"approved",77,"comedy, fantasy, sci-fi",6.4,NA,"lester and orville accidentally launch a rocket which is supposed to fly to mars. instead it goes to new orleans for mardi gras. they are then forced by bank robber mugsy and his pal harry ...                see full summary »","charles lamont","bud abbott, lou costello, robert paige, mari blanchard",2611,NA
"100",100,"all i desire",1953,"approved",80,"drama, romance",7.2,NA,"in 1910, a wayward mother re-visits the family she deserted.","douglas sirk","barbara stanwyck, richard carlson, lyle bettger, marcia henderson",1266,NA
