"","rank","title","release_year","rating","runtime","genres","movie_rating","metascore","description","directors","actors","votes","gross_in_millions"
"78",78,"crime school",1938,"not rated",85,"crime, drama",6.8,NA,"a gang of underprivileged teenagers are sentenced to serve two years in a reform school after almost killing a criminal fence who attacked them.","lewis seiler, william clemens","the 'dead end' kids, humphrey bogart, gale page, billy halop",901,NA
"79",79,"rich man, poor girl",1938,"passed",72,"comedy, drama, romance",6.2,NA,"a rich businessman wants to marry his secretary, but first he has to pass muster with her middle-class family.","reinhold schünzel","robert young, lana turner, lew ayres, ruth hussey",212,NA
"80",80,"mr. moto's gamble",1938,"approved",72,"crime, drama, mystery",6.9,NA,"when the #1 heavyweight contender is mysteriously poisoned during a bout, moto knows that identifying the gambler who placed large bets against him is the key to solving the murder.","james tinling","peter lorre, keye luke, dick baldwin, lynn bari",485,NA
"81",81,"charlie chan in honolulu",1938,"approved",67,"comedy, crime, horror",7.3,NA,"while charlie is distracted with the birth of his first grandchild, son jimmy impersonates his father in order to investigate a murder aboard a freighter in the harbor.","h. bruce humberstone","sidney toler, phyllis brooks, victor sen yung, eddie collins",1272,NA
"82",82,"the big broadcast of 1938",1938,"passed",91,"animation, comedy, musical",6.5,NA,"the bellows family causes comic confusion on an ocean liner, with time out for radio-style musical acts.","mitchell leisen, james p. hogan","w.c. fields, martha raye, dorothy lamour, shirley ross",725,NA
"83",83,"the girl of the golden west",1938,"passed",121,"musical, romance, western",6.6,NA,"mary robbins is a moderately educated, beautiful, young woman who owns the saloon called ""the poker"". she is the only woman in the town of couldee-making her the fancy of all the men there,...                see full summary »","robert z. leonard","jeanette macdonald, nelson eddy, walter pidgeon, leo carrillo",320,NA
"84",84,"four men and a prayer",1938,"not rated",85,"adventure, mystery",6.1,NA,"the sons of a disgraced british officer try to clear his name.","john ford","loretta young, richard greene, george sanders, david niven",516,NA
"85",85,"there's always a woman",1938,"passed",81,"comedy, mystery",6.9,NA,"an investigator for the district attorney and his amateur-sleuth wife compete to solve a murder mystery.","alexander hall","joan blondell, melvyn douglas, mary astor, frances drake",407,NA
"86",86,"nancy drew: detective",1938,"approved",66,"comedy, mystery",6.9,NA,"after a wealthy dowager who has made a substantial donation her alma mater suddenly disappears, nancy drew sets out to solve the mystery.","william clemens","bonita granville, john litel, james stephenson, frankie thomas",563,NA
"87",87,"the secret of treasure island",1938,"approved",300,"action, adventure, crime",4.5,NA,"in the prologue, pirates hide a treasure on an island off the mexican coast. and the pirates, the map and the treasure disappear in a volcanic eruption. the legend of the island draws ...                see full summary »","elmer clifton","don terry, gwen gaze, walter miller, grant withers",161,NA
"88",88,"volga - volga",1938,NA,108,"comedy, musical",7,NA,"widely claimed to be joseph stalin's favorite movie, this classic musical comedy is a must-see. the action takes place on a steamboat on the iconic volga river, as two groups of performers ...                see full summary »","grigoriy aleksandrov","igor ilyinsky, vladimir volodin, pavel olenev, sergei antimonov",490,NA
"89",89,"i accuse",1938,NA,95,"drama, horror, sci-fi",7.1,NA,"after serving in the trenches of world war i, jean diaz recoils with such horror that he renounces love and personal pleasure to immerse himself in scientific research, seeking a machine to...                see full summary »","abel gance","victor francen, line noro, marie lou, marcel delaître",333,NA
"90",90,"kentucky",1938,"passed",96,"drama, romance, sport",6.6,NA,"romeo and juliet story set amidst horse racing in kentucky. the family feud of lovers jack and sally goes back to the civil war and is kept alive by her uncle peter.","david butler","loretta young, richard greene, walter brennan, douglass dumbrille",353,NA
"91",91,"young dr. kildare",1938,"approved",82,"drama",6.8,NA,"fresh out of medical school, young dr. james kildare decides to take a position at a large new york hospital instead of joining his father's country practice. in new york he meets the ...                see full summary »","harold s. bucquet","lionel barrymore, lew ayres, lynne carver, nat pendleton",366,NA
"92",92,"you and me",1938,"approved",94,"crime, film-noir, romance",7.1,NA,"an altruistic department-store owner hires ex-convicts in order to give them a second chance at life. unfortunately, one of the convicts he hires recruits two of his fellow ex-convicts in a plan to rob the store.","fritz lang","sylvia sidney, george raft, robert cummings, barton maclane",797,NA
"93",93,"the shining hour",1938,"passed",76,"drama, romance",6.1,NA,"a nightclub dancer marries into society and has to contend with her jealous sister-in-law.","frank borzage","joan crawford, margaret sullavan, robert young, melvyn douglas",661,NA
"94",94,"college swing",1938,"passed",86,"comedy",6.4,NA,"gracie alden tries to graduate on college to get an inheritance.","raoul walsh","george burns, gracie allen, martha raye, bob hope",306,NA
"95",95,"sinners in paradise",1938,"passed",65,"adventure, drama, romance",5.8,NA,"a seaplane departs for china. on board are a nurse escaping a loveless marriage to do work with refugees, a woman hoping to surprise her estranged son, a wealthy heiress trying to distance ...                see full summary »","james whale","madge evans, john boles, bruce cabot, marion martin",239,NA
"96",96,"the spider's web",1938,"passed",300,"crime, action, drama",7.3,NA,"a crime fighter known as the spider battles a villain called the octopus, who is out to sabotage america and install his own government.","james w. horne, ray taylor","warren hull, iris meredith, richard fiske, kenne duncan",86,NA
"97",97,"four's a crowd",1938,"approved",92,"comedy, romance",6.5,NA,"robert will do anything to get the big account that has eluded him. his public relations business makes public angels of rich scoundrels. jean needs someone to save the paper and she wants ...                see full summary »","michael curtiz","errol flynn, olivia de havilland, rosalind russell, patric knowles",724,NA
"98",98,"tarzan's revenge",1938,"approved",70,"action, adventure, comedy",5,NA,"eleanor and her parents are hunting big game, acompanied by her wimpish fiance. ben lleu bey wants to add her to his 100-woman harem. tarzan wants her too.","d. ross lederman","glenn morris, eleanor holm, george barbier, c. henry gordon",401,NA
"99",99,"lord jeff",1938,"approved",85,"crime, drama",6.7,NA,"spoilt child geoffrey bramer teams up with a pair of small time crooks to pose as an aristocrat and steal jewelry from exclusive shops. during a a caper, geoffrey is caught and is sentenced...                see full summary »","sam wood","freddie bartholomew, mickey rooney, charles coburn, herbert mundin",270,NA
"100",100,"just around the corner",1938,"passed",70,"comedy, musical",6.6,NA,"shirley helps her idealistic architect father get his dream of a slum clearance project; the little miss dances with bill ""bojangles"" robinson. based on paul gerard smith's book, ""lucky penny"".","irving cummings","shirley temple, joan davis, charles farrell, amanda duff",424,NA
