"","rank","title","release_year","rating","runtime","genres","movie_rating","metascore","description","directors","actors","votes","gross_in_millions"
"91",91,"the man who played god",1932,"tv-g",80,"drama, romance",7.4,NA,"after losing his hearing, a musician uses lip-reading to help others.","john g. adolfi","george arliss, bette davis, violet heming, andré luguet",713,NA
"92",92,"the cabin in the cotton",1932,"tv-g",78,"drama",7.1,NA,"a tenant farmer's son is caught in the middle of owner-tenant disputes when he falls for the plantation owner's seductive daughter.","michael curtiz","richard barthelmess, bette davis, dorothy jordan, hardie albright",1119,NA
"93",93,"million dollar legs",1932,"passed",64,"comedy, sport",7.2,NA,"a small country on the verge of bankruptcy is persuaded to enter the 1932 los angeles olympics as a means of raising money. either a masterpiece of absurdity or a triumph of satire, ...                see full summary »","edward f. cline","jack oakie, w.c. fields, andy clyde, lyda roberti",672,NA
"94",94,"beauty and the boss",1932,"unrated",66,"comedy, romance",7,NA,"the baron is a banker, in vienna, who works at at very fast pace. he appreciates beautiful women, but fires the beautiful miss frey as he considers her a diversion to work. susie sneaks ...                see full summary »","roy del ruth","marian marsh, david manners, warren william, charles butterworth",367,NA
"95",95,"tiger shark",1932,"unrated",77,"drama, romance",6.5,NA,"a tuna fisherman marries a woman who doesn't love him.","howard hawks","edward g. robinson, richard arlen, zita johann, leila bennett",626,NA
"96",96,"little orphan annie",1932,NA,70,"comedy, drama",6.7,NA,"daddy warbucks has to go on a long trip, leaving annie alone. while wandering the street, sandy leads annie to discover mickey, who is crying. mickey's grandmother recently died, and he is ...                see full summary »","john s. robertson","mitzi green, buster phelps, may robson, matt moore",39,NA
"97",97,"fanny",1932,"not rated",125,"comedy, drama",7.7,NA,"after fanny's boyfriend leaves her and sails away, she finds out she's pregnant.","marc allégret","raimu, pierre fresnay, fernand charpin, orane demazis",1161,NA
"98",98,"arsène lupin",1932,NA,84,"crime, mystery, romance",7,NA,"a detective is tasked to capture an elusive thief called arsene lupin.","jack conway","john barrymore, lionel barrymore, karen morley, john miljan",640,NA
"99",99,"the woman from monte carlo",1932,NA,65,"drama",5.3,NA,"add a plot","michael curtiz","lil dagover, walter huston, warren william, john wray",115,NA
"100",100,"hot saturday",1932,NA,73,"drama, romance",6.6,NA,"a pretty but virtuous small-town bank clerk is the victim of a vicious rumor from an unsuccessful suitor that she spent the night with a notorious womanizer.","william a. seiter","cary grant, nancy carroll, randolph scott, edward woods",765,NA
